,prof_id,quality,difficulty,comment
1421,1180604,5.0,2.0,Her class is very interesting and engaging. And no studying for the exams or finals!The we have weekily quizzes but they are not worth much points. just do well in two major assignment and you will get an A. we had a take home finalthat i finished in two hours.She's so cool!
1422,1180604,3.0,4.0,"She's very religious so if you're not into that, you will not like this class. Her weekly quizzes asked for verbatim quotes from the text--that's crazy! She does listen to the students' feedback, though. The subject is interesting and saves the whole course."
1423,1180604,2.0,5.0,GEEZ!! DONT TAKE HER!! SHEZ FRICKEN NUTS!! Her TESTS are hard! She would ask questions that are unreasonable! You would have to spend more time studying and reading for her class than your care plans!!!
1424,342977,5.0,3.0,"Dr. Boutrous is an awesome, friendly professor interested in seeing her students succeed in the practice of mock appellate advocacy. From beginners to returning students, she is patient with them all. As for grading, she does base the grade on mostly 2 exams and one final appellate brief, so make sure that you are thorough in your writing."
1425,342977,5.0,3.0,The BEST teacher in the entire world. She really cares about her students and will do anything to help you succeed if you make the effort. She is the best advisor and mentor. Even if you're not pre-law or poli sci i totally recommend taking at least one class with her your time at the mount.
1426,342977,5.0,3.0,LOVE DR. B!!!! SHE KNOWS HER MATERIAL AND ENGAGES THE CLASS IN STIMULATING CONVERSATION. SHE IS NOT ONLY A GREAT PROFESSOR BUT A GREAT ADVISOR AS WELL. SHE ONLY ASSIGNS ONE PAPER AND TWO SHORT ANSWER EXAMS SO YOU HAVE TO BE ON TOP OF YOUR STUFF! OVERALL DR. BOUTROUS IS A PASSIONATE PROFESSOR AND IT SHOWS WHEN SHE PRESENTS THE MATERIAL!
1427,342977,5.0,4.0,"DR. B is AWESOME! She is both my professor and adviser and I don't think I would want anyone else guiding me through my college career! Dr. B is very sweet, intellectual, and very professional on all levels! She is really passionate about teaching Politics and very knowledgeable of the subject. She is always out for your best interest. Best @ MSMC!"
1428,342977,5.0,2.0,Her lectures are enough to get through the class if paid very godd attention too. Great professor!
1429,342977,2.0,4.0,"People say she's easy, she's not. I don't have interest in political science. Majority of the class we're pol sci majors. Favored them over others. Tests are ALL ESSAY FORMAT @ short answer. Can't bs in this class. No hw or quizzes so you have to do well on 3 tests or your screwed."
1430,342977,5.0,3.0,"Professor Boutrous enjoys teaching her political science classes. She is very interested in the subject and can get way ahead of herself in debates and candidacies. She does refer a lot to the textbook, so if you want an A in her class you must take very good notes and read the text thoroughly."
1431,342977,5.0,3.0,great professor. take notes. all tests are with blue books.
1432,342977,5.0,5.0,"Dr. Boutrous is the best professor at MSMC. I've taken several of her classes and I am still amazed by this woman. She is so intelligent, professional, and responsible. Although her courses are difficult if you put in the effort it is definitely possible to get A's. TAKE HER CLASSES! It'll be the best thing you ever did."
1433,342977,5.0,4.0,she is amazing...never had a prof that made a class as interesting as she does! id come to the mount just for her!
1434,342977,5.0,5.0,Dr. Boutrous is the best!! I have taken her for alot of my Political Science classes and I just fall more in love with my major!! She is very helpful and wont let you down when you need that help.
1435,342977,5.0,3.0,Excellent
1436,342977,5.0,3.0,Amazing
1437,342977,5.0,3.0,"Amazing teacher. When she walks into the room, you just can't look away. Her lectures are never boring. If you pay loads of attention to her lecture than the exams will be easy."
1438,342977,5.0,3.0,she is the absolute best prof. for tests just listen to the lecture and you will be fine. Highly recommend her...if you are not a poli sci major you should at least take one class with her...you'll switch
1439,342977,5.0,1.0,The best teacher at the MSMC!
1440,342977,5.0,1.0,Brilliant teacher!
1441,342977,5.0,1.0,GREAT !!!
1442,342977,5.0,2.0,"Dr. B is awesome, she is always there for her students, her class may be difficult, but she is always there for you, she will work with you and try her hardest to help you do well."
1443,342977,5.0,3.0,"Best professor ever, she is the complete package rolled into one. She is challenging, but in a good way. She is incredibly intelligent, she knows everything there is to know about law and politics, and she makes everything so interesting because she walks into class like it is a court room and makes you pay attention to her with her charming witt."
1444,342977,5.0,2.0,"Moot court is great and she makes learning all the objections, rules and demeanor in the court interesting. She is very helpful and a great teacher, you feel that she's on the ball and knows what she's talking about"
1445,342977,5.0,2.0,"She's a geat professor, I love her way of teaching. She keeps her students interested."
1446,342977,5.0,3.0,"Great Prof.... She makes her class very interesting, and she throws out topics that really makes you think outside the box!!!!!!"
1447,342977,5.0,3.0,Really clear and very passionate about her work in law and politics.
1448,342977,5.0,3.0,"Very good professor, tests are based on lectures &amp; text. You will diffinetly learn alot from her. She is also very fun and funny."
1449,342977,5.0,4.0,"Great teacher and great lecturer. The tests are a little difficult so you really have to study hard, but it is very possible to get an &quot;A.&quot;"
1450,342977,5.0,2.0,"Okay, such a fun class! Very interesting, cool project with the debate. Lots of notes, tests are based on the lectures. Hard tests, but fun class and cool professor!"
1451,342977,5.0,2.0,No Comments
1452,342977,5.0,2.0,No Comments
1453,342977,5.0,3.0,"Great professor. Slightly hard tests. Lots of fun. Very informed. Great lectures, very interesting."
1454,2118611,2.0,3.0,"She talks SO incredibly fast! I could not follow along when in class, so I was forced to rely on my own reading when taking quizzes. She does not post grades online when you need her to, no matter how much you beg. Weeks can go by before you see a grade from the start of the semester."
1455,2118611,4.0,3.0,"C'mon Coello! Really, you don't have that many reviews, yet? Here goes: Professor Coello cares about her students; she has your back. Oh, the shade she will THROW if she knows that a professor is not being fair! She is such a sweetheart.  Yes, she does get flustered a lot, and she talks fast. However, she's there for you; you can learn from her."
1456,2118611,3.0,3.0,"Professor Coello talks really fast during her lectures, so be sure to hone your note-taking skills because it is one of the only ways you'll remember what she says.  She can be frustrating because she expects a lot of you, but she also understands that you're one person.  She is not that patient; her timing isn't great. However, her class is doable"
1457,2118614,2.0,3.0,while it seems she has a good heart I don't know If it's the heart of a teacher. tends to come off aggressively to some questions and it is easy too feel judged. Goes on tangents very frequently which can make it hard to focus on the subject matter and absorb any class-related content. Wouldn't recommend taking if you actually want to learn. 
1458,2118614,1.0,2.0,"super weird. never explained anything! she would answer aggressively when you had a question. literally wouldn't assign homework, but then assign 100 assignments in one week due back to back! "
1459,2118614,4.0,4.0,Professor Khamou is extremely knowledgeable and is very efficient in getting the tough concepts across. She can come off and a bit cold/mean but I think that’s just her personality and nothing to take to heart. The class is difficult but she makes it do-able. I would recommend! 
1460,2118614,1.0,3.0,"Khamou is a cool professor up until it's lecture time. She goes off a lot of tangents. If you take her, be prepared to teach yourself. Attendance isn't mandatory, but if you don't attend class you will not know what's happening."
1461,2118614,2.0,2.0,"Lectures/zoom meetings only help when she does worksheets but she rants/goes off topic way too often so it extends how long we spend on each chapter. She can be rude at times, the work and tests/quizzes she gives are easy, but she doesn't grade homework or worksheets on time."
1462,2118614,2.0,1.0,"Khamou is an okay professor, in lab she always came late &amp; starting ranting about random things leading us to start lab late &amp; end late. When the fire happened she when MIA &amp; at the end of the semester she gave everyone B+ for lab. She also have favorite students, she never remembered my name &amp; always called me friend or aren't you ___ friend."
1463,2118614,4.0,3.0,"Professor Khamou is not a difficult professor. However, she is kind of rude sometimes and rants way too much. She was also always late to class. I dreaded going to lecture because it did not help much. Just learn how to use all the equations in chemistry and physics. She only grades the homework (for each chapter), two quizzes and two exams."
1464,2118614,5.0,4.0,"If given the chance, take Professor khamou! She is one of the few in the department that ACTUALLY cares about her students future and shes very helpful. She is a great advisor as well and very approachable! Dont be afraid to ask her for help or introduce yourself!"
1465,2118614,3.0,2.0,"She is a great professor, knows her stuff however takes her time. Goes off on a lot of tangents. My anxiety got worse in her class because she wouldn't just get to the point. She has strong opinions don't let her downgrade you."
1466,2118614,2.0,3.0,"Took a class along with her lab a couple of years ago... she talks way too much, goes way off topic and then complains when students get bored and use their phones. The only thing I would say that sucks is how easily distracted she gets. Her grading isnt too bad and overall she cares about her students."
1467,2118614,4.0,4.0,"I don't recommend taking this class along with another class. It's easy to fall behind in an accelerated class like this when you have a lot of reading to do and group assignments to turn in multiple times per week. She's clear with grading. Two exams, a final, and quizzes for every section."
1468,2118614,4.0,5.0,Professor Khamou is very caring and will help you if you ask she will have office hours by appointment. Read the book and study the slides she provides you with. You will really have to work for your grade she isn't an easy a but will prepare you for things such as medical school.
1469,2118614,5.0,4.0,"I took the Scientific Concepts online course with professor Khamou. I must say this class was intimidating since I always feared Chemistry and I had never taken Physics before, but she provided me with the resources necessary. I won't say it was easy, but I worked hard for my grade. Professor Khamou is quick to reply and gives great feedback!"
1470,2118614,5.0,5.0,"Professor khamou is a fantastic and kind science professor. Her class requires plenty of dedication and commitment to studying and reviewing the material that you learned in class. She does expect students to participate in class, therefore pay attention because she may call on you. Take the homework packets seriously and do not be absent to class"
1471,2118614,5.0,5.0,"Professor khamou is a fantastic and kind science professor. Her class requires plenty of dedication and commitment to studying and reviewing the material that you learned in class. She does expect students to participate in class, therefore pay attention because she may call on you. Take the homework packets seriously and do not be absent to class!"
1472,2118614,5.0,4.0,"She is amazing!  If you pay attention in class, ask tons of questions, study her lectures and past exams you are golden!  Her exams are very straightforward, if you study what you are supposed to, you will do well.  Focus is more on application of material than concepts."
1473,2118614,1.0,5.0,She is not available for outside help.
1474,2118614,5.0,3.0,"Dr. Khamou makes sure you understand the material.  If you're not the best with chemistry or physics, take her because she will make sure you understand the fundamentals before proceeding.  She was fantastic!"
1475,2118614,4.0,2.0,"Professor Khamou is one of those who try to be funny, but the fact that she's trying is funnier than the joke, itself.  She might go on a tangent, but she stays on track trying to make sure that you understand chemistry and physics.  She's a professor that wants you to try.  She won't shame you if you need help, and she's aware that you have a life"
1476,1539032,5.0,2.0,"She gives essays, but they're doable. She clarifies what she wants in the essay as well. She's very nice, but be sure to do the assignments and homework she gives!! I enjoy her class although there will be times where it can be a little boring. In addition, she'll tell you what the midterm and final will be on. She's a really good teacher!"
1477,1539032,5.0,2.0,"she was really cool, except that she gives you to much essays to do. Then someonetimes you have to rewrite it. also, her finals and midterms are so dumb because they are from lectures she gave us that she didn't really specify on"
1478,2184159,4.0,2.0,"He's a really good professor! Really teaches you what you should know for the tests during his presentations. If you study his powerpoints, you will be able to pass the weekly quizzes and the midterms. Also curves the midterms really well to help boost up your grade."
1479,1479651,1.0,5.0,"Do not take Comiso for lab. She NEVER explained ANYTHING and when you asked for help, she never really helped you. I would recommend taking Turjman for lab instead"
1480,1479651,4.0,3.0,"I had Comiso for Micro Lec &amp; honestly it wasn't that bad. She's super nice &amp; if you are ever confused she'll take the time to explain. As long as you do the study guides, you'll pass. Everything you need to know for quizzes and exams are on those study guides. You have to stay on top of your material &amp; study, but I'd definitely take her again."
1481,1479651,5.0,3.0,"Dr. Comiso is caring and considerate. I had her for lecture and lab. Both classes were asynchronous. Attendance isn't mandatory, but attending them is helpful. Dr. Comiso knows what she's talking about and is very willing to help her students understand the material, just reach out. Her exams are straight to the point. Study and you'll pass."
1482,1479651,3.0,4.0,"She's a nice teacher. Her class is pretty difficult, didn't really learn anything. She gives a lot of homework and I'm not even sure if her tests relate to the work."
1483,1479651,4.0,3.0,I took Dr. Comiso for microbio lab and lecture and received As in both of her classes. She is super sweet and always willing to answer questions. Her lectures can be very unclear at times as she trips over her words often but her tests are never out of the ordinary from the material she goes over and assigns. Just study well and you will pass!
1484,1479651,1.0,3.0,"Professor who teaches primarily lower division biology courses for nursing teaching an upper division biology course to bio students? Was confused often on what she was explaining herself, read off figures, I can do that myself. I wish the biology department would have gotten our regular biology professors to teach not a nursing professor."
1485,1479651,1.0,3.0,Had not taught Immunology in years and decided to teach Fall of 2018. She definitely needed a refresher because she could never answer students questions. I would never take this professor again she is not a good lecturer. BEWARE! Take course somewhere else if you can.
1486,1479651,3.0,5.0,"Maybe this was her first time teaching an online class. Who knows, but tests were extremely hard and irrelevant to the readings. She did not use a textbook, but maybe that would have been better than the free online material as it was too broad and difficult to navigate. HW and discussions were interesting,but would not recommend this class online."
1487,1479651,5.0,3.0,"Dr. Comiso is best! She's really sweet! I had her for Microbio Lab and she really wants everyone to do well in her class. As long as you write enough for the lab reports and study all the labs needed for the midterm and final, you should be okay. Make sure to study every aspect of the background, procedure, and results of each experiment!"
1488,1479651,5.0,2.0,"Dr. Comiso is the BEST. She is very clear and provides in death explanations and is so interested in what she teaches! She is always willing to help and always offers office hours, so take advantage! A lot of dense material and diseases, etc. but it is doable and really fun. Great experience, would definitely take her again, she is so great!!"
1489,1479651,5.0,3.0,"Comiso is a great professor. She is always there to help you when you need it. The class itself is really fun. Make sure you do the reading beforehand though, because she does often give pop quizzes."
1490,1479651,4.5,2.0,"Dr. Comiso is AMAZING! She is very clear in what she wants. Study the slides and take notes in lecture and you'll pass. If you don't get an A, it really is something that you aren't doing. Easiest pre-nursing science hands down. "
1491,1479651,4.5,1.0,"Dr. Comiso is a great teacher. Her tests and quizzes are very easy if you retain info from slides. She does not go into too much detail on certain concepts, which is nice. Study the slides thoroughly and passing will not be a problem. Many opportunities for points in this class. Show up to class because participation accounts for much of the grades"
1492,1479651,2.5,2.0,"Attendance is MANDATORY and really helps with your grade. Her tests and quizzes are easy, but her class is VERY boring. Tests&quizzes are based on lecture slides. Memorize them and you'll do fine. Don't wait till the night before to study though, it's A LOT of material."
1493,1479651,4.0,4.0,"Comiso is a pretty good teacher. Compared to the other microbiology teacher, she's a saint! All quizzes and tests are based MOSTLY ON POWERPOINTS! use the book only as a reference, otherwise you'll end up going too in depth on subjects and you will lose the general idea."
1494,2143220,3.0,4.0,"Her class was pretty difficult. I especially hated the multi-part weekly discussion posts that were only worth 5 points. They took me anywhere from 30 minutes to two hours or so to complete, only for 5 points. It seems ridiculous. However, she had good informative PowerPoints, and they helped a lot with the tests."
1495,2143220,1.0,4.0,"Dr. Yusim was not the greatest professor I took. Her wifi was bad all the time, so she would cancel the class, or it would take her forever to fix it while she was teaching. Her instructions were at times unclear, which made it hard to complete assignments. There was always a lot of homework to do and people were confused half of the time in class."
1496,1496083,2.5,2.0,"I would say her class is not hard. There is one field trip to a museum, then you have to write a short paper. The majority of her lecture is picture of art. To pass her quizzes, mostly study the pictures, dates, and artists. "
1497,1496083,2.5,4.0,"Her class is so boring, she does not try to make it interesting. Her so called ""quizzes"" are more like exams!"
1498,1496083,1.5,4.0,"Dont take her class!! avoid her class,take something else its not worth it.her lectures are all powerpoint,she makes the class go super slow. and does not make art sound interesting at all!"
1499,1496083,4.5,1.0,"Only uses powerpoints which can be boring. But she is nice, she will help if you talk to her. Highly recommend participating. Other than that she is not hard to pass be on time and participate if you want an A."
1500,662550,4.5,1.0,Professor Johnson made the class fun and inspired a lot of students with her many adventures and movies about the west. She is a great writer and allows you to re-write your papers for as long as you want till you get a perfect A. She also does not have any deadlines for homework so you could turn it in whenever you want. 
1501,662550,3.0,2.0,Prof. Johnson was a great!! truly recommend her. 
1502,662550,4.0,1.0,"English is really easy with Proff. Johnson! She always said ""Good Writing is Rewriting!"" She literally regrades your paper until you are happy with the grade you want to get! Although attendance is mandatory, They are simple lectures. I would definitely recommend you take her for English!  "
1503,662550,5.0,3.0,Professor Johnson is one of the best English teacher I've ever had. She makes English interesting and fun. We went a couple of times to watch a play and it was a great experience. These are not mandatory nor for credit but you will love going for your own knowledge. I can't wait to take another class with her.
1504,662550,3.5,2.0,"She is very cool, being a theatre person she is very mellow. You can tell she enjoys talking and lecturing in class, as she often talks about her own life. Overall very cool class, very chill, but she can be vague at times with assignments and midterms. Just pay attention and you will survive. Participation leads to a higher grade in class."
1505,662550,3.5,2.0,"Textbooks ARENT NEEDED. Make sure to listen to what she wants, and participate. Don't just sit in class and expect to get a good grade you need to voice your opinion and share your stories . A great class, not many assignments, very easy, enjoyable, but if your looking for a SUPER hard English class with tons of work probably not this one."
1506,662550,3.0,1.0,Prof. Johnson is very sweet. Her beginning lectures and teachings on gangs and prison was SUPER interesting. At times she talks about herself the entire class time but only because most don't participate in the convo's. I myself ALWAYS would participate in discussions in her class. She's an easy A if you participate and get involved in class!
1507,662550,2.0,1.0,"Grade teacher, talks about her life and lets you out early. No textbook needed,attend class because she is entertaining. Such a sweet professor. No due dates until end of semester."
1508,662550,2.0,4.0,She talks a lot and nothing is really based on anything that we did in class. It is an easy class but you do have to make sure you are always there and do everything she asks. Make sure to participate it will help your grade. Even though you hardly have work make sure you do absolutely everything she ever said to you.
1509,662550,5.0,1.0,One of the most amazing professors I've ever taken. She will teach you a lot more than English and is challenging but makes you reach your full potential. She has a world of knowledge about EVERYTHING! You leave her class wanting to take more of her classes whether or not you need them.
1510,662550,4.5,1.0,She is too easy. All you have to do is attend class and listen. I went to her office every chance i could and that also what helped me pass ! Take her !
1511,662550,5.0,4.0,No Comments
1512,662550,3.0,1.0,She lectures ost of the time. She isn't a tough grader. As long as you turn everything in on time and you show up on time you will be fine.
1513,2065431,5.0,2.0,"I had Professor Dinsmore for FYS, and his class was very easy. No exams or quizzes. Just written assignments and participation proof for attending workshops and events. Very kind Professor and cares for his students. Easy to get an A if you just do the pretty simple assignments and attend class. Very reachable and understanding."
1514,2065431,5.0,1.0,"Amazing teacher! Super easy, funny, and great class. I would take it all over again because he made English enjoyable."
1515,2065431,5.0,3.0,"Professor Dinsmore is so understanding. He really loves when students participate in class. He is super engaging, and I never found his lectures boring. His essays were very interesting to do, and he is always open to help with your work if you need it! I highly recommend him."
1516,2065431,5.0,1.0,"He is such a great Professor highly recommend, he is helpful with giving out feedback with your essays. He keeps the class interesting as well, never a boring class."
1517,2065431,5.0,4.0,"Hes very interested about what he teaches and has great energy. Youll love the class, I took him for both semesters my first year and I dont regret it was an amazing class and would definitely take him again."
1518,2065431,5.0,2.0,"Professor Dinsmore is a real gem. Hes funny and offers great feed back. He even makes lectures interesting by changing up his voice, similar to role play. Expect to write some papers but theyre never too difficult. Dinsmore is a sold choice, hes great."
1519,2065431,5.0,2.0,I love Dinsmore he has made a big positive impact on my academic education I wish I could have him for the rest of my college years ! Best professor hands down .
1520,2065431,4.0,1.0,Very chill teacher! He gives great advice on papers
1521,2065431,5.0,3.0,Professor Dinsmore is a great English professor. I enjoyed taking his class because I learned so much about grammar and structuring essays. I enjoyed the positive academic environment and his funny jokes.
1522,2065431,5.0,2.0,"Took him for 6A and 6B, definitely a great professor! There are weekly discussion posts/reflections based on credit or no credit. Grade is based on basically  two essays assigned the whole semester. Everything is straightforward on the syllabus, and the class focuses on other essays as well as watching movies and documentaries. Easy A class!"
