,prof_id,quality,difficulty,comment
0,143362,2.0,3.0,"For a critical thinking class, she does not critically think whatsoever. She only questions students' answers and does not allow for student questioning. very strong about her own beliefs and she chooses which philosophers she agrees with to teach about. I wouldn't participate in her class because she tells every student they're wrong. Not great."
1,143362,5.0,1.0,So good
2,143362,5.0,5.0,"Great Professor. I loved her class, she's hilarious!!! I came out writing much better."
3,143362,4.5,4.0,shes da bomb
4,143362,5.0,4.0,"OMG! she was so much fun, and so funny. her class is hard, but if you just go to the lectures, she explains it all and you'll do well on the test. i wish i had the units/time to take her again! she's sooooo nice."
5,143362,4.0,3.0,awesome prof...class was entertaining too.
6,143362,5.0,2.0,No Comments
7,143362,4.0,4.0,No Comments
8,1372166,4.0,2.0,"Laidback n gets sidetracked easily but it makes the class enjoyable. There IS a textbook but I got an A w/o it bc I did all HWs &amp; we always discuss the reading in class-- so make SURE you show up! Class  viewing diff sources like vids, documentaries, articles, etc based on the week's content which was WAY better than an hr+ long lecture every day!"
9,1372166,3.0,2.0,"Garcias a chill professor, most of the assignments are online and its an easy A to just complete them. Hes nice and doesnt mind answering any questions or concerns. However, his grading expectations are high; for ex: a 95 is an A- when typically its an A or a 92 is a B+. Just make sure you do the assignments and you will be fine :)"
10,1372166,4.0,3.0,"Father Garcias tests are medium level difficulty so be sure to study. Lectures are sometimes interesting. Do not skip class, he takes attendance everyday and it counts!!! He only assigned maybe 2 papers and the exams are taken online. Only thing that sucked was he did not curve exams no matter how bad the results were :/"
11,1372166,5.0,4.0,"Awesome Professor! I had never read a bible before but Father Garcia made it so interesting, by giving more details. Hes hilarious, lectures are more of an open discussion mostly. I am taking another of his classes next semester."
12,1372166,5.0,2.0,"Im shocked to see all these low ratings, he is an amazing teacher and he is hilarious. I took him for Death and Afterlife and he was amazing, he really knows his stuff and will explain more if you don't understand. "
13,1372166,4.5,3.0,"I am taking him for Intro to Hebrew Scriptures and he is absolutely amazing! He talks about the stories in the bible so if you are confused during the reading he will most definitely go over it in class. Make sure to pay attention during the lectures because everything in the test was discussed in the lecture, even if it wasn't in the book."
14,1372166,2.5,2.0,took him for christian ethics. All assignments are turned in online and check your emails every day  before you go to sleep. Interesting topics but not consistent and a bit all over the place. There's like 5 different professors coming in and out to teach. He's a nice guy.
15,1372166,2.0,3.0,"Be sure to turn in all assignments, no late assignments accepted! He incorporates what he posts online to his exams on top of the readings from the textbook. Make sure you understand the stories from the Bible. Take notes when he talks about those stories and review them after class. "
16,1372166,2.0,2.0,"Need the book mostly for assignments he gives. Do not understand how he gives the questions on the exams. Mostly on  his lectures. He was really unorganized. Participation does matter because the more you participate, the better your grade will be. You get to enter your own participation in an angel dropbox so participate!!"
17,1372166,4.0,1.0,I don't really get why the reviews here are so low.   His study guides are great because he basically fills it all out for you.  Study the study guides and do the readings and I don't see why you wouldn't do well.  He is a very smart man and knows the bible thoroughly.  I love the perspectives he gives about the stories in the Bible too.
18,1372166,2.0,2.0,"Father Garcia is very nice and is understanding about absences and helping to raise your grade. If you don't pay close attention and do all the readings, you're not going to learn anything from him because he's a push-over and lets giggly girls get him way off track and he'll ramble on and on about something unrelated. Was an interesting class."
19,1372166,1.0,1.0,This man seemed to care but he is easily influenced by the women and nuns that run his life... I am thankful for his small amount of help. He is not a professional and as a Priest he should not be running the Religious Studies depart here...
20,1372166,1.0,3.0,He was very entertaining during class. Was not able retain from his class. His test are not based on lectures make sure to read books & stuff posted online (mostly stuff online). He can be very sarcastic. NO LATE WORK ACCEPTED!! Takes attendance everyday.
21,1669128,3.5,1.0,Amos is a bundle of energy to keep you intrigued especially with politics. She knows her English discipline well. She's very approachable and helpful to get a good grade. But her class doesn't have much structure to know what is expected throughout the semester. She's either absent or cancels class often. Her class is a vacation in the semester.
22,1669128,5.0,1.0,A Great Teacher!!!!!!! You learn alot to improve your speech! Very helpful and caring. I recommend taking her. She is an awesome teacher!
23,1669128,5.0,1.0,"Prof. Amos is awesome. Her class is a nice break from the rest of your classes. You end up saying a fair amount of speeches, but her grading is not hard and equally as fair. There is never a dull moment in her class as she speaks her mind and does not hold anything back. Bottom line, take her. You will not regret this class or teacher!"
24,1372170,5.0,1.0,Scott is amazing. You have to take one of his classes. He gives great lectures and his classes are enlightening and humorous. If you are looking for a challenge then someone else might be more suited for you. If you want a class where you can learn and not be drowning in work and have fun then he is the perfect professor.
25,1372170,5.0,1.0,"Pretty great professor. Very helpful and you learn a lot about yourself. He makes it so that what we learn, we apply it to our own lives. Take it!!!"
26,1372170,5.0,1.0,Best teacher I've ever had! Extremely unconventional course. You'll learn so much about yourself in the process. Take him! So awesome.
27,1372170,5.0,1.0,"Great teacher, loved his class.Super creative, you won't be bored.The class is very unconventional , more like a personal trip through life stages.Take it!"
28,2287646,5.0,3.0,"Logic was not easy. However, Professor Walt does his best to help you understand the content. He is always willing to help and if he notices most of the class did poor on something he does the most to help the class out. I think during this pandemic, he has been the most understanding professor I've had."
29,2287646,5.0,4.0,"Prof Walt is a gr8 professor and person, but the class content is DIFFICULT to understand. He gives great lectures &amp; doesn't mind us asking questions in the middle of a lecture. He's also the ASC tutor for writing+philosophy, &amp; if u attend, u get extra credit! Def do your homework bc it's based on completion &amp; provides a huge cushion for exams!"
30,2287646,5.0,3.0,Professor Walt is the best professor I have had at the Mount. Lectures and Assignments are straight forward and easy to understand. He's typically always available for any questions or help you may need. Professor Walt makes philosophy so much more interesting than anyone else I've had. He's a great professor with a great character and charisma !!
31,2287646,5.0,4.0,"Professor Walt is definitely one of the best professors I have had here at the Mount. His lectures were very informative and easy to follow along to. He is very passionate for philosophy and will do whatever he can to make sure his students understand the material. I would highly recommend taking any course he offers, you will not regret it!"
32,2287646,5.0,4.0,"Professor Walt is a fantastic human being who ACTUALLY cares about his students learning in and enjoying his class. I have always struggled with philosophy but he worked very hard to create lectures that were fun and easy to follow, his class is the only good experience I've ever had with philosophy. Very funny too, sad not to have him anymore!"
33,2287646,5.0,3.0,He is really great and always helpful. Truly cares about his students and wants to make sure they understand.
34,2287646,5.0,3.0,"Prof Walt is brilliant and a caring person. Hes good at explaining details, encouraging participation, and ensuring we are learning the material. He is readily available to help in office hours and at the Learning Center, too. Definitely enroll in any course he teaches!"
35,2134050,4.5,2.0,"He's a fun professor, and actually wants to help his students. If you want to get extra credit points, talk about how amazing the circle of fifths is. You're welcome."
36,2074661,4.5,1.0,She gives a lot of homework if she notices you all dont care about the class. But gives extra credit at the end of the semester. 
37,2117671,5.0,1.0,"Professor Berndt is such a sweetheart. She is really understanding that people have lives outside of school, there were times where she would give our whole class extensions for projects or assignments. The only downside is the textbook that you need for the homework assignments. Besides that, her class was really easy and I enjoyed it a lot."
38,2117671,5.0,3.0,"Professor Berndt was very flexible in her online course. She was understanding of everything going on and extended certain deadlines. She made material easy to understand in her recorded lectures. She wasn't really a difficult grader, just make sure you complete everything and put in your best effort. Manage your time wisely! There was a lot to do!"
39,2117671,5.0,3.0,"The summer course had a lot of reading and assignments each week, but professor Berndt was really flexible with deadlines as long as you reached out to her. She gave a lot of extra credit opportunities and always gave feedback on each homework turned in. Study guides for the exams were also really helpful"
40,2117671,5.0,2.0,"Such a great professor, would take again. Is very clear when teaching so there is no confusion. She knows what she is talking about and makes the material relevant to the outside world and social media so this makes class captivating and engaging. She doesn't just sit there and stare at you like other professors at the Mount. She is also reachable."
41,2117671,5.0,2.0,Such a great class to take! If you need to take Philosophy I would really recommend her! It is a night class and lectures are three hours long and you stay for the whole time which can be boring! But probably best philosophy you can take!
42,2117671,5.0,2.0,"Professor Berndt is absolutely incredible! She is beyond my favorite professor. She explains everything very well and is very knowledgeable. Her class includes: exams, quizzes, writing assignments, homework, and a final. Philosophy can be very difficult to understand; however, Professor Berndt makes it easy to understand and remember."
43,970793,5.0,2.0,i was very scared to take Dr. Cheng's course this past semester.... i am so grateful i did! she was very detailed when explaining the importance of each chapter. she did very well at explaining what will be on the exam! you must always read the book and the homework questions are your bestfriend! 
44,970793,5.0,2.0,Professor Cheng is by far my most favorite biology professor. If you read and study her slides you will pass her exams. If you don't understand something ask questions! She will explain the concept to you in the best way possible.
45,970793,3.0,3.0,she refuses to accept any late work or give any extra credit. There are weekly pop quizzes. The exams have 50 questions and she puts things that we never even learned in class.
46,970793,5.0,2.0,"Previously I failed bio1 &amp; had to take her to move forward in my biology career, when taking her she provided extra worksheets to help us understand the material better. She is also a great lecture I was able to understand everything she talked about &amp; she cares about everyone in her class and is willing to provide extra work to have everyone pass."
47,970793,3.0,4.0,I don't really like her class. I can barely understand her because of her accent. Recommend not taking if you have a choice.
48,970793,5.0,4.0,"This review is regarding her lab. She is so patient and does her best to help you with labs. Her in lab quizzes and two exams were kinda difficult, but you just need to make sure you read the background information. Attendance is counted for Lab!"
49,970793,5.0,4.0,"Dr. Cheng is not a difficult professor if you study right. She is straightforward and all you really have to study are her slides, worksheets, and Mastering. I believe she made Micro really easy to understand. Pay attention and engage in lectures! Other than that, she is so sweet, understanding and is always willing to help her students."
50,970793,5.0,4.0,"I took Dr. Cheng for Bio 5 and I'm currently taking her for microbiology lecture and lab. She's a very good professor. MAKE SURE TO STUDY. Microbiology can be tough but make sure to study and you'll definitely pass. If you need help, make sure to go to her office hours. Overall, she's a very helpful and caring professor."
51,970793,3.0,3.0,"Professor Cheng is okay, she is tough, and you really need to put in the work. Also, she could be hard to understand so be aware of that. Just make sure to study for the class and put in the time, and you should be fine."
52,970793,5.0,3.0,Her material is super straightforward. I'm gonna be honest I only read her PowerPoints to prepare for her exams and I got good scores the only reason I got a B was because I slacked off at the end. BUT! She's super easy if you just pay attention to the lectures and DO THE HOMEWORK. Overall she's a pretty great professor.
53,970793,4.0,2.0,"I think Dr. Cheng could be a challenging professor, but her materials are pretty straightforward. If you understand her lecture materials, as well as, do plenty of practice questions from mastering homework and utilize the textbook, I think passing the class will be a breeze."
54,970793,3.0,2.0,"She is very understanding and fair. If you dont put in the effort of study time, then you will not pass"
55,970793,5.0,4.0,"I took this professor for bio5, and she is more of a better professor in micro. Tbh, most of the criteria is based on powerpoints/ teaching yourself to understand and its either you know it, or you don't. Very good professor compared to other bio professors at the mount."
56,970793,1.0,4.0,Hard at grading. Have to turn in work on time. Do not give second chances. Need to pay lots of attention to the lectures and lots of reviewing on quizzes and exams. She is not a very easy teacher.
57,970793,1.0,5.0,Can't understand her. Your best friend would be the textbook
58,970793,3.0,1.0,She is a good teaching but sometimes/most of the times i cant understand her.
59,970793,4.0,1.0,"Easy A class. If you show up and pay attention to her slides, you won't have a problem passing. I didn't get an A because I simply did not try. I rarely paid attention to the lectures and crammed everything last minute. I know I could have gotten an A. You have to try in order to fail her class."
60,970793,4.5,3.0,Professor. Cheng has great Power Point slides for her lectures. The slides are an easy study guide for quizzes and exams. If you study and take the class seriously you will get an A+
61,970793,3.0,3.0,"If you dont go to the lectures, you wont know what she's going to cover on her quizzes/test. But if you read on your own you can pass without going to class. Plus she doesnt take roll!"
62,970793,4.0,1.0,"quizzes and exams were easy..you just have to memorize a lot of groups terms, etc."
63,1984551,5.0,4.0,"Great professor. Goes step by step. Dont be afraid to ask questions. Her YouTube videos help (students know which ones were talking about). Totally of topic, but an instructor outside of MSMU had a picture of her on one of the PowerPoints being lectured."
64,1984551,5.0,3.0,Professor Higgins is extremely clear about every topic that she covers. The book is not needed to pass the class. There are exams almost every week but three are dropped so there is some room for mistakes. She is always available and tries her very best to help her students as much as she can. I suck at match but I managed to pass with an A-.
65,1984551,5.0,4.0,"Great teacher. she's straightforward and makes science interesting and relatable. She offers lots of resources like her youtube channel, dropbox which has answer keys of previous quizzes and tests, and office hours where you can ask her personally for help. tough class bc I had no background in chem or physics but she made it easy to understand."
66,1984551,4.0,2.0,"Attend lectures and office hours and you will be fine! She teaches step by step and also had youtube videos to help you understand her lectures. At first she is kind of boring, but as she gets used to her crowd shes hilarious."
67,1984551,5.0,3.0,"Tough only if you simply do not try. GO to her office hours; a big help when you're struggling! Will be difficult if you have no high school background on chem,physics, and math, which is why people drop.  No need of text book for her class at all, everything is based on problems from lecture. No hw, only matters exam grades. Overall good professor"
68,1984551,5.0,3.0,She is pretty tough however i Learned a lot from her lecture. You can basically show up to any of her class times but just put your time in your paper for the in class quiz. Overall as a pre-nursing she  is very good with her lecture and if you don't get the concept just show up to her other classes. I got an A and I am not good in math.
69,1984551,4.0,3.0,"Cool teacher! She's funny,takes lecture very seriously and she goes fast,doesn't waste any time she literally takes the whole class period to write on the board(uses every corner of the board) Gives in class quizzes to practice after lecture,super organized but makes things more complicated than what they really are sometimes"
70,1984551,2.0,3.0,"Let me just start off by saying this This class is part of a requirement for nursing students. The class is difficult if you do not have a strong background on math+ science & chemistry. Many classmates did not pass and gave up bc there was no hope in raising their grade up to a C-, also no extra credit.  4 exams , must pass 3 out of 4 & no quizes"
71,1984551,4.5,4.0,"Very challenging teacher, but this is what college is all about! Absolutely felt that this class was very engaging yet very helpful for what my major is. Would definitely recommend her even though she's tough its studying and reviewing that will help, because she offers so much help for one to understand the material before any exam."
72,1984551,3.5,4.0,"Lectures are an hour and a half but it goes by fast because you are so engaged in the lecture. You have to take notes on everything she goes over and you have to pay attention. The material can get tough and the tests can get challenging but seriously, if you study hard before tests and pay attention in class you'll be fine. I ended with an A :)"
73,1984551,1.5,5.0,Doesn't  explain things well at all. Doesn't make any sense whatsoever. Rushes through material. I do not recommend taking her class. It was challenging just to get a C.
74,970795,4.0,4.0,She is very straight forward about the material and teaches it in a way that you can understand. Incredibly understanding that were students and that its a lot of information thrown at once and is willing to work it out with you.
75,970795,5.0,3.0,"I love Dr. Chotiner, she is so engaged in her lectures. I was always eager to attend her class."
76,970795,5.0,3.0,"This teacher is awesome! Neuro and Med Physio... This teacher expects you to know and explain the material in the exams. Her exams tend to be all free response and the questions are more difficult compared to any other bio professors at MSMC. She is comfortable with Q's during class, but if you have too many, ask her during office hours."
77,970795,5.0,3.0,She makes the material very easy to understand. If you don't understand something ASK she is an amazing professor and she will do her best to help you clarify. Best bio professor ever!!!
78,970795,4.5,2.0,"She is one of the best professors at MSMC. Not only is she the department chair but she is also a very awesome professor. Hard to get a hold of so if you need to talk to her, you'll have to look for her but other than that read the book, her slides and ask questions if you don't get it.She tends to go fast sometimes so if you don't get it, ASK her."
79,970795,4.5,4.0,Hard material. She's so helpful! If you ask for it!! Really is a good professor and wants to help everyone. Funny and knows what she's teaching.
80,970795,3.0,4.0,"She's truly a great person. The questions on her tests and quizes make you think! talk to her, let her get to know you.. make sure she knows your name!! I didn't even own the book, and I received a B+ in her class, but i made sure i knew the info and her lectures!"
81,970795,4.0,2.0,"I really liked this class. Dr. Chotiner gives numerous quizzes throughout the semster and several Exams. For some, her test material was hard because they didnt study. If you study..and I suggest reading the bio book by yourself you will get a good grade. Her questions aren't straightforward..you have to think a little. If you like a bit of a chall"
82,970795,4.0,4.0,Her lectures are easy to comprehend and she has a passion teaching students. She really does make you think though. Her tests are filled with critical thinking and this is the hardest part of the class. She uses information from both her lectures and the book.
83,2324521,5.0,4.0,"Dr. Varay will have a long-lasting effect on your education. I highly encourage students to ask questions. At first, I was intimidated by the material in PSY 106 &amp; L, but Dr. Varay's approach to teaching made statistics seem enjoyable. Dr. Varay taught me how to collect, sort, and interpret data. AND the biggest perk of was teaching me how to use SPSS. I appreciate how available she was to talk about her experiences and best practices. I highly recommend her class, just know she expects her students to work hard."
84,2324521,5.0,3.0,Hybrid class. We met once a week. On days we met she lectured then the day we didnt meet wed have an easy discussion online about the topic she had lectured on. Every 2 weeks wed have online quizzes which had NOTHING to do with what she lectured on so no need to pay attention during lectures. Must read the book to do quizzes.
85,2324521,5.0,3.0,Prof Varay is such a sweet and caring professor. She is SO PASSIONATE about what she teaches and you can really see how much she loves being a psychologist during her lectures. She is so inspirational! I took her abnormal class and it did not stress me out at all. It was easy! I def recommend you take her!!
86,1599535,4.0,3.0,"I took Dr. Tang during the pandemic, and her workload is insane. She gives a lot of pages to read, and she provides the textbook online. However, the work is doable but do her homework with time because it's a lot. Study for her quizzes and read!"
87,1599535,4.0,4.0,"Professor Tang is very nice &amp; straightforward. The workload is a lot, but definitely doable. Start your reading &amp; homework the day before it's due to give yourself some time. She's a tough grader, but she'll tell you why she marked you off. She gives you opportunities to earn full credit on perusalls even after it's due &amp; gives extra credit!"
88,1599535,2.0,5.0,So much time was consumed into this class. Do not take if you dont have free time.
89,1599535,3.0,3.0,Really study for her quizzes and exams.
90,1599535,3.5,4.0,"Professor Tang gives a lot of work but is also very helpful. Intro to Psychology was boring but Child Dev was better. She gives parter quizzes and her final is not cumulative. I survived her class and got an A both semester. As long as you do your work, you'll be fine. Never hesitate to ask her for help!"
91,1599535,1.0,5.0,"By far the worst professor I have ever had at the Mount. Wishy-washy, confusing, unclear. Will deduct points from you left and right. DO NOT TAKE THIS CLASS"
92,1599535,1.0,5.0,VERY confusing professor her office hours interfered with my schedule.
93,1599535,1.0,4.0,"Very Confusing professor, she gave me mixed signals"
94,1599535,4.0,2.0,"She is a really tough grader, but she truly cares and wants you to learn the material. She is really nice and pretty funny!"
95,1599535,4.5,5.0,"She is an amazing teacher. Prior to taking her class, I was discouraged by the reviews but was pleasantly surprised. She is very passionate about psychology and will help you if you seek her help. Her class is very difficult but if you read the book and study your notes, you should be fine. Her class was surprisingly interesting and fun."
96,1599535,2.5,4.0,"Julia is a very knowledgeable professor about research and has a great passion for it. I learned a lot from her. However, her directions were unclear and when I asked for help it always seemed to make things worse. I would recommend using her TA and going to her office hours. Quizzes and exams are open book and open note. Study hard!Trust me!"
