,prof_id,quality,difficulty,comment
2055,1975659,5.0,2.0,I don't know why others students are giving Dr. Warkentin such a low rating. I think he is a sweet professor that is ready to explain something you don't understand. His lectures are slow and may be boring at some points but I least I comprehend what he is explaining. I enjoy that the class is interactive when he asks questions or provides examples
2056,1975659,1.0,5.0,"Warkentin reads from the online book and doesn't actually teach. His voice is monotone which makes the class boring on top of hard. He only gives tests and quizzes and if you don't do very well on those, you won't pass the class. His tests are extremely hard because he doesn't generalize the chapter he looks at the small details. Stay away from him"
2057,1975659,2.0,3.0,"This professor is so boring. His voice is super monotone and he basically &quot;lectures&quot; by reading the text book online. He doesn't give any specific main things to study for so his tests are always hard. I had to self teach myself to even pass his class. He only grades tests and quizzes so if you do bad on those, you're screwed. You've been warned!"
2058,1975659,5.0,3.0,"He's an amazing lab instructor, be very thorough on your lab reports, bc he well dock off point if something is spelled/missing. He is VERY HELPFUL will describe the lab procedure & perform it before, will walk around class and make sure you are doing it correctly. Anyone that complains was probably slacking off. Makes GREAT a pie/cake on last day!"
2059,1975659,3.0,3.0,"He's monotonous, but he's such a sweet man!  However, if you can't stand boring lectures and self study, this isn't the class for you."
2060,1975659,4.0,3.0,"- 5 pop quizzes - 1 midterm and final - Final split in two: gram stain and multiple choice exam; he didn't have a gram stain for his other class. I assume it was the difference in class size. Our class was very small - less than 10, which was why he was able to help us individually. He doesn't explain the lab worksheets so good luck with those."
2061,1975659,2.5,1.0,"This is an easy class; however, sometimes sitting though lectures can get quite boring. Be prepared to do some self teaching because you will miss things because of his monotone voice. He tries to make the class less boring by playing videos, but still it is hard to pay attention. This class is pretty easy to pass though overall."
2062,1975659,2.0,1.0,Lecture: read read read. read the sections in the book that correspond to the powerpoints. quiz yourself with the questions in the back of each section. Lab: review each lab before and after the procedures are done. itll make life a lot easier when it comes time for the midterm and final. take really good notes on the virtual lab.
2063,1975659,1.0,3.0,He does not help at all when doing a lab. He can be sometimes as confused as your are when reading the assignment. You're on your own for daily labs.
2064,1975659,2.0,4.0,I felt as though Professor Warkentin doesn't actually teach. Most of the time he would go off on a subject that would not be a part of the exam. His lectures did not help you prepare for the quizzes or exams so you're kinda on your own.
2065,1975659,4.0,2.0,"Dr. Warkentin was a pretty good Professor for Micro Lab. As long as you read over each lab (in case of a pop quiz) and complete each lab for credit, you will be fine. When you are performing each procedure it may feel like Dr. W is not going to help you,  but he wants you to try until you NEED to seek help. Also, his final & midterm are easy."
2066,1975659,4.0,2.0,I liked this class for lab! Just do your work and you will be fine! 
2067,1975659,2.0,3.0,"Dr. Warkentin is more animated in lab than he is in lecture.  That being said, he is a firm believer in letting a person make their own mistakes.  If you mess up or need help, he can be visibly annoyed.  However, he will help you if you ask."
2068,1975659,2.5,2.0,"He is rather monotone, but he does try to get you interested in the subject.  He tries using multiple types of media to get his points across, but you might be asleep as he does.  He is a nice guy that is easy to approach, but he wants to throw you for a loop to make you think."
2069,1975659,3.5,2.0,"Dr. Warkentin is monotone and his lectures can be boring, but if you do the readings in the syllabus his tests and quizzes are easy. Just be careful in lab because he will give out 5 pop quizzes when you least expect it. He's very approachable and if you need help just ask him."
2070,1975659,2.0,4.0,He is very monotone and one of the most boring professors ever. Avoid taking his class. 
2071,1975659,4.0,3.0,"there will be pop quizzes, brace yourself"
2072,1975659,3.0,3.0,he cool
2073,1594733,5.0,3.0,"Dr. Campbell is intelligent, very knowledgeable in the intersecting areas of law and other disciplines, and considerate. You will love her teaching style as she always carries a positive mindset. Introduces lively stories to her lectures to show you where your major and field can most effectively be applicable. She is hilarious--you will enjoy her!"
2074,1594733,5.0,1.0,"This professor now is at CSULB as a social work law and policy professor. She is very kind, and willing to go the extra mile with her students. 1 mid-term, 1 final, 1 paper. Provides study guides that are very helpful!"
2075,1594733,4.0,3.0,"First thing to note is that she is open to questions. She used a lot of videos to teach the class in order to cater to the learning styles of the students. Student filled out a survey where they selected which teaching styles they prefer. I understand this is helpful to many students, but this did not work for me."
2076,1594733,5.0,2.0,Great teacher and great person!
2077,1594733,4.0,3.0,Great teacher!
2078,2016623,2.0,4.0,"Do yourself a favor and don't take her. Assignments are uncleared( doesn't explain well nor provide examples). I didn't sign up for her class, I was assigned to be in her class. Pretends to be sweet and nice at first. She isn't too approachable. Tough grader!!! Expects perfectionism on assignments. Unprofessional by having her son in zoom class"
2079,2016623,4.0,4.0,"She's nice but a tough grader. Also, she's unclear on her grading criteria."
2080,2016623,1.0,4.0,She really makes it impossible to pass. She is very strict with grading and does nothing to help you improve your grade. Takes long to grade assignments but grades very hard. Expect long discussions post for an 8/10 at best. I was 1% away from a passing grade and I got disqualified from pre-nursing because of this course. Take anyone else.
2081,2016623,1.0,4.0,"Avoid her for SOC1; both in class and online, she is a very strict grader regardless of how much effort you put into anything, such as discussions or group projects. She always expects more than what you turn in, and getting an A is almost impossible."
2082,2016623,1.0,5.0,booo
2083,2016623,1.0,4.0,"Felt as though the class had an unfair and unclear grading scale. No matter what you did, it wasn't ever enough despite all the effort. Do not recommend ever taking, and would not take any course with her again."
2084,2016623,1.0,5.0,Do not take her class. You spend more hours focusing on her class than any other of your major classes. She is unfair with grading and tries to make sure you DO NOT get the grade you worked so hard for. I was at an A throughout the whole semester and she tried every possible way to bring me down to a B in the class when grades were due. AVOID HER.
2085,2016623,5.0,4.0,She is amazing! Pay attention and make sure your phone is off.
2086,2016623,4.0,4.0,"Higareda is a great professor if you are unsure of what you want to do because she really loves sociology. Be warned: she is a tough grader, and she does expect a lot out of you if you want an ""A"" in her class. She does have favorites; those favorites are the people who actually pay attention in her class. So, it is within reason. I love her!"
2087,2016623,2.0,4.0,"Most young professors grade the worst, not sure why that is. She seemed nice, but can be harsh with grading. I've done very well in my classes except for hers. Until today I don't know where I need improvement, I just know it wasn't the caliber of work she wanted."
2088,2016623,4.5,4.0,"As long as you go to class and keep up with your work this class is manageable. She breaks up the research paper and has you complete it and turn it in in stages. She returns it with great feedback. At the end of the semester, as long as you utilize the corrections she made the class is not as scary as you think it will be."
2089,2016623,4.5,3.0,"Professor Higareda is very nice and helpful but although she gives study guides to help out with the tests, her short essays need to be answered specifically in order to get full points. Make sure to listen to her lectures and to also do well in presentations. Also, make sure to be present at all times because you lose points for activities done."
2090,2016623,5.0,2.0,I thought she was really thorough as to what she expected from us. You really need to study the material to do well in the class.
2091,2016623,5.0,4.0,This course is an upper division class that requires time. It is a great class to take if you are interested in the Social Work field. Professor Higareda encourages her students to do great and she is willing to give you the extra help if you need it. There is group presentation and papers but she guides you through them. Overall great experience.
2092,2481529,5.0,4.0,"If you are looking to learn the proper way to complete a case conceptualization, take Professor Chavez's class. I gained in-depth knowledge on how to differentiate between multiple disorders. Her teaching approach is relevant and personal. Professor Chavez is clear about classroom expectations and assignments and has a great sense of humor. I highly recommend taking Professor Chavez PSY 140 course."
2093,2481529,5.0,2.0,"Professor Chavez is a really relatable and sweet teacher who really cares about her students. Her lectures go along with her power points and are very useful when learning. Just show up! There were group activities for credit but not annoying ones, they were fun and educational. I would take her for any class if given the opportunity again!"
2094,2481529,5.0,3.0,"One of my top 3 professors-I will let you know when I graduate if she was #1! Her class is so much fun, you learn a lot and she implements self care activities to start the class which is a new took you can use with clients. She makes class relevant and keeps things real! Quick grader and she gives you freedom to develop your own thoughts and style"
2095,2481529,5.0,4.0,Amazing. My absolute favorite professor at MSMU. She brings different activities everyday to not only help us decompress but she explains why the activities are useful and how we could use these activities with our future clients. That alone makes her different from so many professors because she really cares for you as a student and your future.
2096,2481529,5.0,3.0,"She is a genuine person and professor. She cares for her students education and future in the field. She is so eager to teach &amp; creates an effective learning environment. She really breaks down the material so well. Everyday she brings excitement, tips to what to expect in the field, recommendations or activities. She is simply amazing."
2097,2033021,5.0,3.0,"Took him this spring and he was amazing! Attendance was ideal but if you emailed him, he would understand. Gave chances for extra credit."
2098,2033021,1.0,1.0,He is ok he could def be better. I have him for my abnormal class and he takes forever to grade assignments and reply to emails and should be more serious when teaching.
2099,2033021,5.0,2.0,just great!
2100,2033021,5.0,3.0,engaging and encourages learning &amp; you do! He wants everyone to do well and get the most of the opportunity.
2101,2033021,4.0,2.0,"I've taken his class multiple times and I've learned a lot in all of them. He cares about his students and his students' learning. He also attempts to get to know everyone and promote unison for the whole class. Class assignments consist of online quizzes, reading, and fun presentations."
2102,2033021,5.0,2.0,"He is passionate about his job and students. I would take his class a million times and not get bored, he is hilarious. You will not be sorry for taking his class!"
2103,2033021,5.0,3.0,"Great professor, he obviously cares about his job and students."
2104,2033021,5.0,3.0,"He knows the material and shows a real love for psychology - and caffeine. WHATEVER YOU DO, TAKE HIS CLASS. That way, no matter how much you pay, there will be a class that is worth the time and effort.  He is inspirational and very loved."
2105,2033021,5.0,2.0,Great professor and would recommend anyone to take him for any of his classes
2106,2033021,5.0,3.0,"I love this class. It's the only class I do not dread attending. It is fun. There are quizzes almost every weekend, but they are only 10 questions long and easy as long as you actually paid attention in the class. It is definitely worth taking if you want to take an intro to psych class. Good luck guessing the professors age though."
2107,2033021,5.0,3.0,Professor Alvarez really is an amazing professor.  He shows a passion for psychology. This was my favorite class. I highly recommend taking any courses with  him. You will really enjoy them.
2108,2033021,5.0,1.0,"Really nice guy, best teacher I've had."
2109,2033021,5.0,1.0,"He was my favorite teacher this semester, and he made me not want to miss class. He is really funny and is an amazing teacher and easy to get along with. You won't regret taking his class and as he says he's changing lives and changing majors."
2110,2033021,5.0,1.0,"He uploads his powerpoint presentations before class so that you can follow along in your laptop during class. His weekly quizzes (most of them 10 Q's) are based on material he reviews and stuff from the powerpoints, although he'll put a gimme question sometimes. He is always simple and clear while being an inspiration."
2111,1105278,5.0,4.0,"Honestly the best clinical instructor Ive had. She does challenge you, but leaving my med/surg 3 clinical having her as an instructor sure made me learn the last few things I would need before being a RN on my own. She does expect you to know your stuff, and if you dont know READ, AND FIND OUT! She's great, will challenge you but in a positive way!"
2112,1105278,1.0,5.0,"Prof Burrell is a soft spoken, nice lady but she has a long way to go as a teacher.Class is 4 hr long, BORING to death ,and full of personal stories that are not relevant.Class should last 2 hr top and to the point.The only thing she does is READ the PP .Prof has not idea how to teach or clarify the already boring Roy model.Waste of time and MONEY."
2113,2262418,5.0,3.0,"Prof Neufeld was such a great teacher! He is passionate about phil and he makes the class very interesting (even if you don't like philosophy). I can say this class contributed to my knowledge about life. He grades hard on papers like grammar, structure, etc. A lot of reading but ur good on all the tests if you take notes in class and don't read."
2114,2262418,4.0,5.0,"I liked Prof Neufeld, but I had a hard time understanding the material in class. I would take him again, I would just be extra prepared to read more and study more. I did not pass his class but I would recommend him if you enjoy philosophy. He is very passionate about the subject."
2115,2262418,4.0,3.0,I enjoyed the material we were learning in class &amp; he lectures on the chapter we do homework on and gives quizzes frequently. I would suggest doing the homework because it helps understand material better. His 2 papers are difficult bc you have to research on opinion based articles. If you take notes and study for all his tests you can earn an A.
2116,2262418,5.0,4.0,"I don't usually enjoy Philosophy, but Professor Neufeld makes the class very interesting. He also believes in each one of us and it's very inspiring knowing that he is there for us. He is very passionate about Philosophy and he made the class enjoyable. Listen to his lectures and take notes all the time!"
2117,2262418,2.0,4.0,"The class was 3 hours long and torturous. The final paper should not be on the book he chose. He knows the class did not read the text every week because it was a lot to break down so, for him to have the final be on it is just setting up the class to get bad grades. The final paper topic should be changed."
2118,2262418,1.0,1.0,very hard
2119,2360726,1.0,5.0,Avoid
2120,2360726,4.0,4.0,"Professor Kulmac Butler is a sweet, genuine guy. He clearly loves philosophy and knows what he's talking about. The reading material is pretty difficult to read but he is very open to discussion and dissecting the material. He gives study guides, 2 papers, 3 exams, and small reflections. He is open to reading drafts, which is helpful."
2121,2756003,1.0,3.0,He was always late and missed classes unexpectedly sometimes without notifying students. He is also not very professional
2122,1840549,2.0,5.0,"Dr. Silverman personally is great on lecturing his materials, but his grading criteria are quite fair yet tough for an introductory history class. He grades strictly on reaction papers, mid-term, quizzes, final, participation, and presentation, and nothing else. He gives a class an extra credit opportunity, so take it!"
2123,1840549,3.0,4.0,Professor Silverman is a History genius whose lectures are thorough and detailed but he is not able to engage with his students. There is a social awkwardness that keeps students from really getting into discussions with him regarding the subject matter.
2124,1840549,1.0,3.0,"Not clear when it comes to what he wants you to do on reaction papers. When emailed about it, never responded until the 6 hours after it was due. He did not even answer the question I had asked. He gave a very basic and vague response. He was late to class almost every single day. Blamed it on traffic, but always had a Starbucks as he entered class"
2125,1840549,3.5,2.0,"At first he was really tough. A lot of people still dont like his class. In my opinion, take notes on his PPT, not so much on lect.  Gives ""pop"" quizzes(tells you in advance), his quizzes are on vocab thats listed on the beginning of every PPT. WRITE those words down and MEMORIZE word for word the def for the vocab in his PPT. you'll be fine!"
2126,1840549,4.0,1.0,"His lectures consist of reading of his personal PP. With that being said, his class can be intellectually stimulating if one likes history and appreciates it. But the prof overall could use other teaching techniques to enthuse his students. He was ok in my book."
2127,1840549,1.0,2.0,Was not prepared for class .
2128,1840549,1.0,5.0,He is not prompt. He does not post the slides on time. He does not lecture in way that is effective.
2129,2475435,5.0,3.0,"Dr. Anne Richards is a wonderful professor, but you will definitely want to participate in class! The more interested you are in the material, the better. During personal struggles, emailed me to check in and make sure I was okay. Very kind and caring. Make sure to read the books! She usually assigns good material."
2130,2475435,1.0,5.0,"You need the books she asks for, for the weekly papers she makes you write. If you go to her she won't help you. Her lectures are boring. She makes you check in your phones in the beginning of class. I advise you look into different professors."
2131,718257,2.0,4.0,No constructive criticism is provided.  Responses were short and did not contribute to the overall mission of the school.
2132,718257,1.0,4.0,Does not respond to email. Very disconcerned with teaching the MBA program.  Arrives to class unprepared unshaven and disinterested.  Refuses to
2133,718257,5.0,3.0,"Professor Gosselin is not hard, but he is for the serious student. He goes beyond the call of duty to ensure a good understanding of the subject. He's not bad on the eyes either."
2134,718257,4.5,1.0,love hime the easiest class every in the world...just memorize everything...you will pass with flying colors
2135,718257,5.0,2.0,"I took him for Principals of Marketing, Advertising, Finance, MIS and Consumer Behavior... by far the easiest class if you take pretty good notes and study/memorize all the slides. For Bonus point questions remember the movies or articles or special things he mentioned that are not in the slides."
2136,718257,5.0,2.0,great professor! really nice and understanding. Wants all his students to do well and really cares! one of my FAV's
2137,718257,3.0,5.0,"Finance is a very difficult subject, but Professor Gosselin is approachable via email or after class for questions. This class is VERY tough.."
2138,718257,5.0,2.0,He is a very understanding professor. Very clear on explanations and does not continue until everyone in the class understands! He is absolutely fantastic!!
2139,718257,4.0,2.0,Easiest class I've ever taken at the Mount. Just memorize everything on all of the slides.
2140,949687,4.5,3.0,O'Callaghan is one of Mount Saint Mary's prominent professors of philosophy. He keeps his students engaged and eager to learn.  His focus on ethics (bio and economic) improved the quality of my life.
2141,949687,4.5,3.0,Dr. O'Callaghan is funny and a good teacher.  You will get an A as long as you argue your point using the criteria he gives you.  It also helps to come to every class even though some may feel it's not necessary.
2142,1385915,5.0,2.0,"Dr. Samuels' class was like a breeze. It was online, but all the homework/exams/quizzes were manageable since it was all at my own pace. The homework did get repetitive, but it was easy to go through. "
2143,1385915,5.0,1.0,"When I took her class it was asynchronous so everything was done myself &amp; my pace bc of this the course was very easy. We had about 3-5 assignments depending on the week but they were simple like discussion &amp; short assignments. I really enjoyed the class, it was an easy A."
2144,1385915,2.0,3.0,"Prof. Samuel is nice, but just so boring, my god! Its hard to sit through her lectures without wanting to leave. She gives excessive amounts of work that only ends up being worth 5-10 points. I really did not see the point of the course in general. All of the info covered were things most people should already know about life after graduation."
2145,1385915,5.0,2.0,Lots of assignments but really easy points. There are quizzes every week but you get 3 tries. There are 8 short papers and project due at the end of the semester but she tells you about it in advanced. I did all of them the night they were due and got full credit but don't procrastinate. If you do the work she will give you the full points.
2146,1385915,4.0,1.0,"She IS boring, but I don't see how a math class could be taught in a fun way. This class was hybrid, so on Fridays, we had online quizzes due. The bright side was that the quizzes stayed open from the beginning of the semester until the day it's due. Exams were online and only open for 24 hours, but you could open a quizexam and come back later."
2147,1385915,3.5,3.0,She is boring and predictable but good. She follows the same format for all of her classes.
2148,1385915,5.0,1.0,"Read the book and you'll do fine. Lectures arent too great and her in-class activities make you feel like you're back in high school, but she is very nice and helps with any questions you may have."
2149,1385915,5.0,1.0,"She is unbelievably nice, but JUST SO BORING. It's hard to sit there and listen to her go on for an hour and a half. Her tests are very easy, as are assignments. Sadly, attendance is mandatory so you can't just skip out on her boring lectures."
2150,1385915,4.0,1.0,"Attending class is not necessary, you just need to read the textbook in order to pass. She assigns homework everyday and there is quiz every other class, so it can get tedious to study all the time for"
2151,2307522,5.0,2.0,She is a fantastic professor I would take her again in a heartbeat.
2152,2416098,4.0,4.0,"Like most people I know, math is not the best subject. of course, for someone who does not enjoy math, this class was fairly difficult for me. Dr. Jun had amazing lectures and knew exactly how to explain the sections, if you have questions she is available 24/7! very sweet and empathetic towards her students. "
2153,2416098,4.0,2.0,"Dr. Jun made the course asynchronous, so you do have to be on top of it. She gives a lot of homework, and she does give extra credit. The class was easy. She would upload videos showing the math problem step by step. It was clear, and if you need assistance, you can meet up with her through zoom."
2154,2416098,5.0,3.0,Amazing teacher who genuinely cares about her students and wants us all to succeed. Gives tons of extra credit opportunities that help boost your grade. Will answer any question and provide great feedback. This course helped me score better on the math portion of the Kaplan.
2155,2416098,1.0,5.0,"Professor Christine Jun for Math 02x will give quizzes every Monday each class will provide you with 3-5 pages of homework to do in which you need the textbook for every course. Won't explain the material and will move very quickly, if you need help with a math problem go to the SRC and have them tutor you because her office hours aren't much help."
2156,220650,1.0,4.0,"Horrible woman she oppose everything and anything you say. Gives a very ""highs chool""  like project that's totally bogus and a waste of you time and money. She not very helpful when you ask her questions , loves to talk about herself and not very accommodating.... why is she even teaching"
2157,220650,1.0,5.0,NO.
