,prof_id,quality,difficulty,comment
2035,711740,4.0,3.0,Professor Harris' lectures are well organized and she is very clear about what you need to know for tests. The reading assignment is nothing in comparison to many of the other classes at W&L. There is a two page paper every week but it is just to show that you grasp the concepts taught in class and to help prepare you for the final and midterm.
2036,711740,2.5,2.0,"The exams are basically recitations of weekly notes.  Friday discussion groups can be boring, especially since she's too busy writing questions on the board."
2037,711740,3.5,4.0,"Really nice teacher. Ridiculous workload for an intro class. 1.5-2.5 page paper single spaced due every Monday, about 100+ pages of reading a week, not an easy grader, expects a lot from you. Somehow i still don't hate the class must be because she is really nice and loves the subject, constantly available for help, loves her students."
2038,711740,5.0,2.0,"The nicest lady. She puts all of the notes up on the board during class. Worst part is that there are 2-3 page papers due every monday morning, and that you have to read about 70 pages before coming to class on Friday. She's such a nice lady though that it didn't bother me..."
2039,711740,5.0,2.0,"It is a mildly interesting class.  Very straightforward.  If you just do the work then you will end up with an A.  The weekly assignments get a little time consuming, but it is a good class overall."
2040,711740,4.5,2.0,She is a great teacher. Weekly assignment s help to clarify material and ensure that you are on the right track. This class provides weekly topics that you can flush out with discussion. Every topic area is covered from foreign policy to the Supreme court. Excellent course.
2041,711740,5.0,3.0,"I hear that her intro courses have a lot of busy work, but for her upper-level Biopolicy course she rocked.  Really passionate and knowledgeable about the subject.  Weekly 2-3 pg. response papers, but no term paper!  Class is heavily based on discussion.  Would definitely recommend."
2042,711740,5.0,3.0,lots of work but an easy grader and a pretty cool professor... some of the above comments are unfounded she is NOT a tough grader unless you are an idiot... prof harris is also smokin hott
2043,711740,4.5,3.0,"Very straightforward class.  Weekly papers are time consuming, but graded very leniently.  She is a very approachable professor and I enjoyed the class.  Sometimes lectures can get a bit boring and she is a stickler for attendance and punctuality."
2044,711740,1.5,5.0,Possibly the worst teacher you could ever get in the United States of America. She can make you hate something you're passionate about. Drop immediately or prepare for a LOT of work and a VERY harsh grader.
2045,711740,5.0,3.0,Great teacher
2046,711740,1.0,5.0,"The worst thing that could happen to you!! unless you are masochist, don't take a class with her. she knows what she is talking about- but is a horrible teacher ad grader."
2047,711740,3.5,5.0,a lot of work. but she is very smart and knows her stuff. maybe save her for a higher level class when you are really interested.
2048,711740,1.5,5.0,"Way too much work for an intro class; ridiculous amount of reading and writing weekly, too picky of a grader, DROP the class if u get put in it...seriously"
2049,711740,1.0,5.0,AWFUL. I've never disliked a class more. Unfair and irrational grading. Teaches more about foreign policy than AMERICAN GOVT. Ridiculous work load. Asking her questions doesn't help at all.
2050,711740,1.0,5.0,200 + pages of reading and a 4 page paper every week for a gen en&#63;&#63; she does not explain stuff properly and is an extremely hard grader. even if you ask her for help- all she can say is &quot; it was not satisfactory&quot;
2051,539712,5.0,3.0,"Boylan's a best case scenario for intro accounting. He's a very cogent lecturer and uses lots examples in class, both real life and otherwise. Simple layout with weekly homework assignments and quarterly tests (relative course length). Not too hard, but you do learn the material and if you put the work in A- or A is very realistic. Would recommend."
2052,539712,5.0,3.0,"Best class that I have taken at W&amp;L. The topic is incredibly interesting and Boylan makes it even better. Highly recommend any class with Boylan, especially this one."
2053,539712,5.0,2.0,"Very interesting and funny lectures. Tests are clear and straightforward. If you pay attention and do the practice tests he gives you, you will do well."
2054,539712,5.0,2.0,Great Professor. Pretty easy to make an A in. I would recommend to anyone. He is very clear in the grading criteria and his tests are very straightforward.
2055,539712,3.0,3.0,"Mediocre teacher. I really don't understand the hype. Pretty nice guy, I guess."
2056,539712,4.0,4.0,Great professor and I learned a lot. He also made lectures interesting and provided lots of examples. Tests were difficult and were a major part of the overall course grade.
2057,539712,5.0,3.0,"Boylan is a great guy.  Barely any homework, tests are straightforward and not graded very harshly.  He creates interesting and funny examples to get his points across.  He's always cracking jokes.  100% would recommend."
2058,539712,5.0,3.0,He was a great professor and definitely one of the best I have had in college.  I would highly recommend his class.  His tests are very fair and he explains the material in a fun way.  The him if you get the chance.
2059,539712,5.0,3.0,"TAKE BOYLAN. I knew nothing about accounting before I took his class and I already feel like I know a lot. He really knows his stuff but he also makes sure you know it well. Very accessible, open office hours, is willing to discuss anything to help you. Only downside is that three tests is your entire grade, so if you do bad on one it hurts a lot"
2060,539712,5.0,2.0,By far my favorite professor so far.  His lectures are very clear and entertaining for the subject matter.  The tests are based on the homework and grading is clear/fair.
2061,539712,5.0,3.0,"Scotty B is no doubt the best ACCT professor at W&L. Cool dude and doesn't care if you show up  although his lectures are helpful. The subject is what it is, so test are somewhat challenging. That being said, if you're going to take an ACCT class, Boylan is the man you want "
2062,539712,5.0,3.0,Very straightforward. Knows the subject like the back of hand. If you pay attention and follow with the book you'll do fine. Has a good sense of humor too
2063,539712,5.0,2.0,Great professor and if you are new to accounting take him. Very helpful in his office hours and rarely need to go because he is very clear during his lectures. Fair grader and does not throw any curve balls at you. Also has a great sense of humor and cares about his students. If you reach out to him he will help you a lot.
2064,539712,4.5,2.0,"Crystal clear, lectures are as interesting as they can be, and he gives plenty of practice problems and homework to prepare for test problems.  I would recommend him to anyone."
2065,539712,5.0,2.0,great teacher...very clear...tests dont have any unexpected material...homework is very very manageable...easy to get a good grade if you have any sense at all
2066,539712,5.0,2.0,"Great professor. His exams are challenging but if you study from your notes and work the problems from the book, you'll be fine. Buckeye takes forever, but if you actually do it and understand it you'll be fine on his exams."
2067,539712,5.0,3.0,Very clear and go over examples in class.  Will learn a lot and he is willing to answer any question or meet with you whenever.  Only bad thing is the Buckeyes take forever and are worth hardly anything.
2068,539712,5.0,3.0,Great teacher! Makes everything really clear in class and is available after class. Tests are easy if you study and know the material and go over the cold test.
2069,539712,5.0,1.0,"Mr. Boylan is the man.  I had him in graduate school at the University of Virginia over the summer.  Best accounting teacher i've ever had, and i've had quite a few. If you are signing up for an into accounting class then you can't do better than Scotty Boylan."
2070,539712,5.0,3.0,"Fantastic teacher, totally approachable and he definitely goes the extra mile to make sure you understand the material. Pay attention in class and do the workbook problems he assigns (there aren't many) and you'll be fine!"
2071,539712,4.5,3.0,"Great prof!  Really helpful, clear lectures, tests were fair.  Challenging but do-able"
2072,539712,4.0,2.0,He is such a great guy - gave a fantastic and clear base knowledge for continuing the study of accounting.  I definately know a lot more (just by virtue of having Boylan) than my friends who took 201 with other professors.  Do the workbook problems before the tests and you will be fine.
2073,539712,5.0,3.0,So helpful and nice
2074,539712,5.0,2.0,"Really straightforward, knows how to explain everything well, and actually made accounting class interesting to go to - something other teachers can't seem to pull off. Not a hard class if you study and pay attention."
2075,539712,5.0,3.0,Boylan is a great teacher and one of the nicest professors in the c-school.
2076,539712,5.0,2.0,"He's one of the nicest, most approachable professors in the CSchool, and he makes accounting less boring than it could be.  Makes classes better with personal stories (ask him about moto racing)"
2077,539712,5.0,2.0,Hands down best professor at the c-school. Very clear and reasonable in expectations.  Always willing to help.  Not an easy class (class avg. about a 82) but if you do your work and pay attention in class there is no reason why you can't get an A.
2078,539718,5.0,4.0,"Prof. Bello is brilliant! He knows a lot about East Asian history and culture and will explain the important points very clearly in class. I'm really bad at history so sometimes I cannot follow his words quickly, but I believe his class would be a fantastic journey for history lover. Very patient and quite humorous, I recommend him very much!"
2079,539718,3.0,4.0,"Now that I am over a month removed from taking Bello's chinese history class, I realize how much stress that class put me through. The short essay every week that you dont know whether will be graded or not is so stressful, and Bello is an incredibly difficult (and vague) grader and will give a low grade with not much feedback."
2080,539718,3.0,4.0,"If you enjoy having a chance of getting an A, do not take this class. As a person, Bello is great, but he does dislike most things that are American. That said, he will put more precision on your paper and give you an 85 with little to no comments. If youre truly taking it solely for the subject and dont care about your grade its a great class"
2081,539718,5.0,2.0,"Professor Bello is a genuinely good person. His class is very lecture heavy and can drag along at times; however, he makes Chinese history interesting enough. This specific class was easy and did not require much work at all (just 1 short paper per week) Overall, he is a great professor to take if you need to take a history class."
2082,539718,4.0,5.0,"First, the good. Professor Bello is awesome - genuinely very funny, and passionate about the Chinese history. He somehow makes it interesting. However, the short paper you have to write every week is the only thing you are graded on, and they are BRUTAL. He is an incredibly tough, and often very vague, grader. Do with that what you will..."
2083,539718,4.0,2.0,"Maybe it was 8:00-9:35, but this class could drag lol. However boring it was at times, Bello is a great guy! 100% clear about expectations, never trying to trick ya. Pretty funny at times. Just pay attention, do the work, and participate. It wasn't demanding work (1 1-page essay per week, midterm (one of those essays), and final (3 1-page essays)."
2084,539718,5.0,4.0,Learning history from Professor Bello is such an engaging and rewarding experience because he does an excellent job of making lectures interesting and emphasizing deeper-level thinking of history. He's clear about what he expects from his students in terms of assignments and grading.
2085,539718,3.0,3.0,"Bello actually makes CH semi-interesting, which is an incredible feat. He is nice and understanding especially during COVID-19. Lot of reading and writing abt incredibly boring subjects. He is a huge simp for Communism/CCP which is just annoying. Makes you a better analytical writer, though. Wish he wasn't on Zoom."
2086,539718,5.0,5.0,"Dr. Bello is awesome. His classes are really rigorous, but he manages to make some really dry subjects interesting. No tests or homework, just a lot of writing, which he grades strictly but fairly."
2087,539718,4.0,3.0,"Hilarious professor who really wants students to learn and analyze. Knows a LOT about China. Only thing I didn't like about him: makes assumptions about students' lives and their backgrounds (not a big thing, but kinda irritating personally). Overall, really enjoyed his class, would definitely recommend."
2088,539718,4.0,4.0,"Great, simple format: no testsfinal, just 1 short essay a week answering a ? he assigns.  There's a ton of reading. It's really hard to get an A, regardless of your effort - you just need to be a good writer, no way around it.  He's very fun to listen to, probably the only prof I've had who lectures the whole time but isn't at all boring."
2089,539718,5.0,2.0,"Bello is the man. If you want to know anything (literally anything) about China then you need to know this guy. He not only is fluent in chinese but can read it in multiple alphabets and dialects, like Manchu and Uighur. He loves to teach and will challenge students to write and analyze to their best ability. Must take for majors and non-majors."
2090,539718,4.5,4.0,"Bello is a great guy who is incredibly smart and funny. Never a dull moment with him teasing everyone in existence. Expects every student to analyze very critically, and will not give an A if you don't. Not about memorization, it's about learning how to think and make connections. My favorite W&L professor by far. 4 classes in with him."
2091,539718,3.5,4.0,"pretty cool, eccentric guy. he has lots of energy and he's very passionate about chinese history which is great, but the lectures can still get boring at times. definitely has high expectations for students; you really have to analyze and think critically to get an a. can be a tough grader and kind of vague on what he wants but he def tries to help"
2092,539718,3.5,3.0,Bello is a good dude. Makes class entertaining and keeps the atmosphere loose.  Really smart guy and respects you if you learn his material and attend class diligently.  Wasn't really interested in Asian history beforehand but enjoyed the course.  Highly recommended.
2093,539718,3.0,2.0,"Lectures are pretty disjointed, but the class is pretty straight forward. Bello is a very cool guy though"
2094,539718,4.5,4.0,"really fantastic professor who is concerned with his students.  encourages the use of office hours and is very accommodating.  also, tells you what he really thinks, which is refreshing."
2095,539718,5.0,5.0,"Fun as Hell! But, Hard as Hell. He is so funny! I love Bello as much as I love my 62 inch plasma TV! He does not care much about memorization. He thinks it's really important to learn to think analytically. Also, he really cares about you. If you want to learn about the history of China, take his class. However, he is a harsh paper grader. If you "
2096,539718,5.0,3.0,"Extremely entertaining professor, you cannot fall asleep in his class. He doesnt care whether you memorize anything.  Tests are all open book open note. You also have weekly page long papers.  Everything in the class is analysis.  So if you aren't good at analyzing, don't take his class."
2097,1041478,3.0,3.0,"Eh.  Participate and you'll do fairly well, but she's not a fantastic teacher.  Very very very  helpful when it comes to papers, though.  Go to office hours."
2098,1969236,2.0,3.0,"Knowledgable but too caught up in his own goddess complex to effectively teach. He refuses to lecture, insisting instead that students ramble about topics they know little about. Student engagement replaces professorial guidance and engagement. He seems afraid to challenge students' ideas. He also didn't seem to listen to what students said."
2099,1969236,4.5,3.0," Really respectful of student opinions and wants you to succeed. Discussions are student led and open, mostly enjoyable. Lot's of reading but not unmanageable. Fair and constructive grader. Great experience overall. "
2100,1969236,4.5,3.0,"Very knowledgeable and approachable. Challenges you. Does not give a straight cut answer which can be frustrating, but helps you think."
2101,1969236,3.5,3.0,"Really friendly and wants to see his students succeed, easy to talk to.  Takes a long time to return papers.  Prompts are general and very open, which was frustrating because I like specific prompts.  "
2102,1969238,5.0,3.0,"Loved professor Michelson. Funny and knowledgeableclass was never really a bore at all. The day to day course load is pretty easy. However, the few large assignments will require solid work as your grade is dependent on them."
2103,1969238,5.0,3.0,"Take him! He tries to help students during office hours and is very clear with what he expects from you. Be ready for INTENSE reading needed to get a good grade in the class, but it's interesting. If you don't read or know how to answer questions in class about the readings, it'll definitely show.."
2104,1969238,3.0,4.0,"SPAN164 was... a lot. You'll get through it just fine with a pretty good grade, but if you haven't had Spanish in awhile, watch out. It's extremely fast-paced, and the professor is VERY inflexible if you need to miss class, even if you're sick and have a doctor's note. Plus, the textbook is outrageously expensive and all of the exams are online."
2105,1969238,5.0,2.0,"Professor Michelson is a great professor who encourages everyone to improve their Spanish without being too critical. I recommend him for Conversational Spanish because the class was super easy but I still improved due to his helpful feedback on oral exams and presentations. As long as you try to participate and improve, you will succeed."
2106,1969238,5.0,3.0,"Whoever gave Prof. Michelson an awful rating, ignore them.  He has reinvigorated my love for foreign languages after 14 years of bad Spanish teachers.  Every class had me feeling a thousand times better than when I entered.  If you see this man on a Spanish class you want/need to take, I have one piece of advice: take his class."
2107,1969238,5.0,3.0,Michelson is a really great and caring professor. He gives a lot of opportunity for extra credit and is very willing to work with you to improve your grade. His philosophy is that it's important to create a fun and relaxed environment in class so that it's easier to speak Spanish without worry. You don't have to be great at speaking to do well.
2108,1969238,1.5,3.0,"Honestly, one of the most pointless classes I took at this school. I thought I would be spending the semester focusing on medical terms and how to effectively communicate procedures to a Spanish-speaking patient (only 3 weeks), but we ended up focusing on bedside manner (in English) for the majority of the semester. It got VERY repetitive."
2109,1969238,4.0,3.0,Sweet professor. Very fair grader. Not hard to do well if you take the time to talk with him and work on improving your written spanish skills. 
2110,1668183,2.0,4.0,"Boring, not clear, hard, and extremely strict class attendance policy."
2111,148585,5.0,2.0,This guy is just plain awesome! He can make the hardest stuff understandable. I have never had a more patient and thorough professor who genuinely cares this much about how well we learn the material without losing our minds. Extremely hard class that would probably be impossible for me with anyone else teaching it
2112,148585,5.0,4.0,best math teacher i have ever had! he is incredibly nice and dedicated to helping his students. we are so lucky to have him here every winter and spring term- take him if you can!
2113,148585,5.0,3.0,"Prof Humke is brilliant, dedicated, and makes higher math survivable. Youre really lucky if you get to have a class with him"
2114,148585,4.5,3.0,"Oh Humke!  He is hysterical.  He is definitely out there, but the man can teach.  He makes statistics fun, as well as every class.  We had class MTWF and I don't think I ever went to class on Tuesday and STILL managed to get an A- in his course.  Do the work, learn the stuff, and it's a breeze.  Plus, he's just one awesome guy."
2115,148585,4.5,2.0,"He is an awesome professor.  So nice.  I had class MTWF, and I never go to Tuesday and still got a decent grade.  He really loves the subject that he teaches, which usually translates over to his students.  Real awesome guy"
2116,148585,5.0,2.0,This guy is the man.
2117,148585,5.0,2.0,Dr. Humke made me love math again! He is hands down one of the best profs at the university. he understands that not everyone is a math genius and is always willing to take time out to help you. He's an incredibly dynamic teacher. TAKE ONE OF HIS CLASSES!
2118,148585,5.0,2.0,The best math teacher I have ever had in my life. He is so nice and all he cares is that you know the concepts and not the stupid details. You have to work hard to do bad in this class because he always wants to help you and give you the best grade he can
2119,148585,4.0,2.0,"Incredibly nice guy, very understanding with scheduling tests, giving re-takes, etc.  If I actually did my homework, I think the class would have been a breeze."
2120,148585,4.5,1.0,"An incredibly easy visiting professor from Minnesota. Basically teaches concept calculus. It doesn't matter if you can do the math, you just have to know how to set it up. Still a very smart guy, with a great sense of humor!"
2121,2716784,5.0,3.0,Climate and Society was a fun class. Glad I took it. Lots of readings but the workload was manageable. She is always willing to meet and give really helpful feedback. 
2122,2716784,5.0,4.0,"I enjoyed this class a lot. While the textbook is dense and there are lots of homework, she gives clear and concise lectures and interesting examples related to current events. If you want to understand how economists see the world, this class is for you. Plus, she is a very caring and kind person that genuinely wants you to succeed. "
2123,2716784,3.0,4.0,"Prof. Zhang is super interested in what she teaches. Though the economic lessons are from the readings, she uses ""today events"" for examples. The lectures are just reviews from the book and can be long and boring, even though she doesn't have a monotone voice. Would I take this class again...? Likely not :("
2124,2716784,4.0,3.0,"She is extremely nice and keeps her class involved. You will especially love her if you enjoy the topic you're learning. However, the lectures can be boring at times."
2125,2716784,5.0,3.0,This is for Econ 100. Great Professor!
2126,2716784,5.0,5.0,tough class but worth the effort
2127,2716784,5.0,4.0,Great professor! This is my second course with Professor Zhang. Considering a double major in economics because of her.
2128,2716784,4.0,4.0,She did a great job of teaching a course that is dry because of the material. Class is pretty well structured. The one suggestion I have is to make this a 4 credit course with a mandatory lab. Evening Stata labs can be a drag.
2129,2716784,5.0,3.0,"Not one of those classes for an easy A. Professor cares about teaching and it shows. Just pay attention in class, go to office hrs and do the practice exams and you'll be fine. I like how she posts slides right after class so i can focus on understanding and not spending the entire time copying."
2130,2716784,5.0,5.0,Stats a hard class but the prof. makes it managable. learnt a lot and enjoyed the group project. Prof. always willing to meet outside of class. Clear expectations on grading. Some other comments below seem from those unwilling to put in the work.
2131,2716784,1.0,3.0,"Sadly, she is a relatively unreasonable and unfair grader. And she does not know that much about the material. Won't recommend her class."
2132,2716784,3.0,3.0,"Stats for Econ. Good teacher, but class is very lecture-heavy and very boring at times. Not super interactive, mainly just reading and copying down slides for the entire class period."
2133,347256,4.0,3.0,"Professor Brodie is very insightful and passionate about literature. We have really good discussions in her class, and she is very understanding in terms of extensions and she cares about her students' health."
2134,347256,4.0,4.0,"Professor Brodie is a great person. She makes clear what is expected from the students in order to get a good grade. The written papers are thoroughly revised, and she gives excellent feedback and lets you know what you've done wrong. The readings could get a little boring sometimes though."
2135,347256,4.0,3.0,"Prof. Brodie is great!! In Creative Writing Non-Fiction, we had to write four essays over the semester and were able to revise one for the final portfolio. It wasn't that challenging, but it was fun experimenting with different writing styles. I would definitely take her again. It's a great class to take with a heavy course load."
2136,347256,4.0,4.0,There are only 4 grades in the class (4 papers). But each of these papers goes through an extensive drafting/revision process. Dr. Brodie is clear with her expectations and great about helping you via email or office hours. You must definitely do the readings because she will call on you if you're quiet in discussion. A great intro writing class.
