,prof_id,quality,difficulty,comment
2984,331329,2.0,4.0,"Professor Goluboff is passionate about Anthropology and I respect that, but she is not the greatest professor. Even for a 100 level class at W&L, her readings can sometimes be excessive (BTW, if you do not read, you will not pass). Also, her lectures are not the best because they tend to be confusing. Furthermore, her office hours are not the best."
2985,331329,4.0,4.0,"3/4 poor ratings were from ANTH 101...welcome to W&L y'all...we're prestigious for a reason. Wanna go to grad school/do consulting? Get used to reading! Honestly, she is hard to decipher, but for engaged students that attend office hours, she is surprisingly awesome. She does not compliment lightly and holds high expectations! Live up to them :)"
2986,331329,3.0,4.0,she is okay... not too bad at all. she's kinda passive-aggressive and plays favorites but i learned a lot and didnt really hate the class. if she flat ironed her hair and tweezed her eye-brows she could even be kinda hot
2987,331329,2.5,5.0,she's absolutely terrible. this class is awful and i hate having to go three days a week. NO ONE GO!! there's an incredible amount of reading...more than any class i've ever taken. stay away!
2988,331329,2.5,5.0,"The class material was mostly good, but I did not like this prof's teaching style very well. It often seemed as if she didn't know what she was talking about, and some material was very unclear. Also, if the book ever disagrees with the lecture, go with the lecture as she will expect you to. Also, take notes on class discussion, not just lecture."
2989,331329,4.0,5.0,"The best Prof. @ W&L. This professor knows her stuff ... and expects her students too as well, so you're expected to study, read and participate-and be on time for class. Don't take her class if you think you're going to get an A - I don't know anyone who has, but you're bound to learn a lot from a prof who is evidently passionate about her topic."
2990,331329,1.0,3.0,"I loathe this professor. She is inappropriately passive-aggressive.  She also counts tardies the same as absences, so be careful.  Her intro courses are okay, but she is not capable of teaching upper level classes.    She manages to make interesting subject matter tortuously boring."
2991,331329,4.0,3.0,Very nice prof. Loves her subject and is also one of the few younger professors who respects the Greek system. Tough grader but will make you learn to write better. Attendance policies are a little draconian but not always set in stone. Can be tough to tell if she likes you or not.
2992,331329,5.0,2.0,It was a fun class and pretty interesting.  It is a good gen ed if you want to avoid the C-school.  Essays on tests are rather detailed and tough.  Other than that it wasn't too bad.
2993,331329,5.0,1.0,She's really nice and really excited about what she's teaching. she's readily available for questions and her tests aren't that difficult if you study.
2994,331329,3.5,3.0,"Nice, interesting, and extremely intelligent. However she likes to lecture to the floor and the lack of eye contact is somewhat disconcerting."
2995,2563663,5.0,2.0,"Professor Fisher was a fun, energetic, engaging professor. ENV 110 was mostly discussion-based, with Policy Briefs and Stakeholder Roleplays being the biggest assignments. They do take some work, but roleplays are engaging and enjoyable. Policy Briefs are research-heavy, but not too bad and only a few. I highly recommend ENV-100 with Fisher.  "
2996,2563663,5.0,2.0,"Professor Fisher is so calming. Her class requires a lot of participation, but it is so fun, and you come out of it a better communicator. Her topics were engaging, and her assessments were not bad at all. Take this class and have fun. "
2997,2563663,5.0,3.0,"She is so inspiring (I'm actually an ENV major now) and is arguably, the best professor I've ever had. You can tell she truly cares about the subject that she's teaching. Grading wise, she's very fair as long as you put in the work and you incorporate some of the topics that come up during discussions. I HIGHLY recommend her classes."
2998,2563663,5.0,3.0,"After taking just one class, Prof Fisher is easily one of my fav professors at W&amp;L. She is so nice and makes class very interesting and engaging. Seriously recommend any of her classes"
2999,2563663,5.0,3.0,Great environmental studies professor who is both knowledgable and passionate about the environment. Papers are tough but she gives helpful feedback. I would recommend everyone to take at least 1 environmental studies class in their time at school.
3000,1973840,4.0,3.0,"Dr. Lanier is an excellent intro-level bio professor. The class is lecture-heavy, but she does her best to make the lectures interesting, and there are some in class activities. In lectures, Dr. Lanier is excellent at distilling down complex concepts into understandable bits. I learned a lot and loved the class. There is no busy work."
3001,1973840,5.0,3.0,Professor Lanier is so so sweet. TAKE HER FOR LAB IF U CAN. Much easier than Winder. Let us out of class early every week so it never took the full time. Very smart and kind
3002,1973840,4.0,4.0,"Definitely a tough grader-always finds something to take points off for. However, she gives good feedback about your responses. Lectures almost every day"
3003,1973840,5.0,3.0,"Dr. Lanier is so sweet! I feel really lucky I got to take her for my bio section this semester. She really helped with understanding in her lectures, and I felt her tests were very fair to the material learned in class. She is also so ready to help students with anything outside of class, and she encourages questions within class."
3004,1973840,3.0,4.0,"Cool lady who is very chill and knowledgeable. The catch is that she is unexpectedly  a really tough grader. I got an A in Bio class but only a B+ in the lab and I'm really sure what I did wrong. People say she is better than Winder though, so Bio 111 people should pref her over him."
3005,1973840,4.0,3.0,"I really liked Professor Lanier, she is very funny and her explanations throughout lab really walk you through procedures. She is a tough grader but she gives very constructive feedback! Go to her office hours before lab reports if you can and take good notes during class so you can write a solid paper!"
3006,1973840,3.5,4.0,"Shes an awesome person and good teacher. Very chill a lot of fun. However, an extremely tough grader, which comes out of the blue. If you go to office hours it helps but she'll still be tough. If you follow the examples and put effort in you should do pretty well though. "
3007,2422352,5.0,4.0,Favorite professor I've had in the C school. Only professor I've had who ties the theories learned in class to current events and topics creating really good discussion.
3008,220768,1.0,5.0,"She's not helpful at all. For the sake of your mental health, don't take. She's the worst!!!"
3009,220768,1.0,3.0,"Abahs lectures are neither insightful nor informative. However, you must attend class because she penalizes you by a half-grade If you don't. Abah doesn't grade timely, dumping grades the weekend after finals. Her feedback is rude even when she gives you an A. I came to W&amp;L for its well-respected journalism department but have yet to find it."
3010,220768,2.0,5.0,Professor Abah is the worst professor I've ever had. She lacks empathy for students and grades unfairly. She chooses students she likes and gives them As while everyone else fails. Her grading and expectations are extremely unclear. She gives impossible pop quizzes with random questions. She is not accessible outside of class. Avoid.
3011,220768,3.0,4.0,"Prof. Abah isn't very accessible out of class, but assignment outlines are clear at beginning of year. Course is heavy in papers, quizzes, presentations, group projects. Pretty high expectations and a tough grader. Lots of guest lecturers and lots of textbook reading and quizzes, but if you put in the work you'll be fine."
3012,220768,1.0,5.0,"Abah is the worst. she puts random obscure law questions on tests that she didn't even come near covering in the class. she gives Ds on tests and then refuses to negotiate or even explain. the comments on the test are merely ""-35"" with no explanation. i think she decides course grades at the beg. of the semester and then grades to fit them"
3013,220768,3.0,3.0,"Professor Abah was very knowledgeable about this topic.  She did a good job of making the class interesting and getting the students involved.  I thought I was going to hate this class, but it ended up being one of my favorites! She's great!"
3014,220768,4.0,3.0,"She is one of my favorite professors! Very helpful, knows her stuff, and she's very approachable outside of class. The reason I'm majoring in Journalism!! Oh and I got a good grade in this class too."
3015,220768,2.0,4.0,"Extremely unaccomidating, no flexibility in regard to required presentations outside of class. Unclearand assignments. The textbook, lecture material and tests are all inconsistant. Guest speakers every day. Overall not a worthwhile class."
3016,220768,4.0,3.0,"This class is the reason I got interested in law and am now going to law school. Although she is a bit difficult to follow sometimes, she is helpful in office hours and very amusing."
3017,220768,1.0,4.0,"Got a good grade in this class, but still feel strongly enough to comment on how unhelpful she is. Very unaccommadating for any mishaps that dont fit in with her schedule. Oh and also, she doesnt even teach her own class. She brings in guest speakers every day. Class time completely unhelpful. I WAS interested in journalism...not now after her."
3018,220768,2.0,5.0,"Class is mandatory, but little material covered is on tests. Very demanding memorization of terms. Tests are completely ridiculous, studying only does so much. Made me question my commitment to majoring in journalism"
3019,220768,2.0,4.0,enthusiastic. hard to understand. knows her stuff
3020,220768,1.0,5.0,100% useless--&gt; this course and prof was the reason i will not major in journalism
3021,220768,2.0,5.0,"Lectures are informative and somewhat interesting, then BAM--her tests and quizzes ask for the most obscure and unrelated facts imaginable. Your time would be better spent praying for a miracle rather than studying for one of her tests."
3022,220768,1.5,3.0,No Comments
3023,220768,2.0,4.0,"She started out teaching at W and L and was very easy.  You could get an A by re-reading the cold test.  After hearing that she was easy, she turned crazy, literally.  She has the hardest questions on her test that have absolutely nothing to do with the reading or class lectures.  Sometimes I think that she wants her students to fail."
3024,220768,4.0,4.0,"Had Prof for 101 as well.  Seems like a different person -- prof actually cares and is passionate about the subject of JLaw, whereas she does not put much time or effort into 101."
3025,220768,4.0,2.0,"very nice, and really not so bad.  she's a little hard to understand but she has a lot to offer, she knows a lot."
3026,220768,2.0,5.0,"One of the nicest people at W&L, but if I wanted nice people teaching me, I'd go back to preschool. She's just incoherent. Oh, and hard. She actually curved DOWN my final grade a full three points. You need to perform a miracle and she has to like you to get an A. I wish I was kidding."
3027,220768,1.5,3.0,"She has no idea what she's doing, she told me that there were only 3 rights in the first ammendment.  Her tests have nothing to do with anything and are more like History of Journalism tests.  I didn't learn anything and never wanted to go to class."
3028,220768,1.5,3.0,incompetent
3029,220768,4.0,3.0,Very helpful with all class assignments.  Cares about student learning.
3030,220768,1.5,4.0,"Her tests are ridiculous, consisting of random facts from the textbook along with multiple lists. She's an ok teacher but has unrealistic expectations for memorization. The class makes people scared of the Journalism school."
3031,220768,3.0,3.0,Professor is very energetic and ambitious in her approach to teaching.  She loves the subject matter.  Basic culture/language barriers can create misunderstandings between prof. and class.  Tests are very fair.
3032,220768,1.0,3.0,A really terrible teacher. If you pay this much to go to college the least you can expect is that your teacher can speak English well. Not the case here. She teaches such a useless course.
3033,220768,2.5,2.0,"you wont learn anything about journalism. the tests and quizzes are nitpicky. if you have a cold test those are good to study. dont bother with the reading, except the bold words. not too hard of a class but very boring and she takes attendance"
3034,220768,1.0,3.0,"Blazingly hot... worth every minute of mind-numbing, poorly-spoken-english blather."
3035,220768,1.5,3.0,Power points constantly. Goes quickly and gets irritated if you can't write fast. Hard to understand sometimes and talks a lot. Very specific tests and quizzes.
3036,220768,2.5,3.0,not the most competant professor you'll have
3037,220768,2.0,2.0,"She doesn't really have the best grammar, which makes me not trust her as a journalism prof."
3038,220768,2.5,3.0,"She's really nice, but the class is boring as **** and half the time you don't know what she's talking about."
3039,1582688,5.0,3.0,"Professor Angie lets her students lead the class discussion, and her insights are super helpful for an intro to philosophy. Her notes and lectures are detailed and very helpful to interpret the difficult readings. She is very attentive and caring, I would definitely take her again for future classes!"
3040,1582688,5.0,2.0,"One of the most caring teachers I have had. Professor Smith wants her student to succeed and is always available for those seeking extra help. She keeps her classes very entertaining, and I genuinely enjoyed going to class each time."
3041,1582688,5.0,3.0,Professor Smith is everything you want in a professor. One of the kindest people I have ever met- take her if you get the chance.
3042,1582688,5.0,4.0,"I took her PHIL-104 class, and it made me want to major in the subject. She's a great professor- super nice, grades fairly and gives good feedback, and has really interesting lectures. The papers can be long and the topic complicated, but if you understand the arguments you should be fine. The lectures help a lot. The final is really tough though."
3043,1582688,5.0,4.0,"Prof. Smith is super nice and very knowledgable about philosophy. She's great at explaining the topics in lectures and she really tries to engage the class so try to participate whenever you can. However, I found the readings to be quite difficult and if you've never taken a philosophy class before, writing a philosophy paper can be tough."
3044,1582688,5.0,3.0,Great Professor!!
3045,1582688,4.5,3.0,"Prof. Smith is one of my favorite professors so far. Participation is key, but you have to meaningly contribute to the class discussion when you do. Sometimes the class can get boring as students ramble, but overall a very fair and straightforward course. What ever difficulties you have Prof. Smith will always help. "
3046,1582688,4.5,4.0,Do not take this class unless you are a philosophy major.
3047,1582688,5.0,3.0,"She teaches some difficult subjects, and that's where all the difficulty comes in.  I've had several courses with Professor Smith and she is hands down one of the best professors on campus.  She is very open-minded, incredibly nice, excellent in her explanations, and very fair in grading.  Take a class with her before you graduate!"
3048,1582688,4.5,5.0,"deceptively hard class but very interesting, and she is one of the nicest people I have ever met"
3049,1582688,4.5,3.0,"Modern ethics. Lots of complicated and wordy readings but class discussions are solid and you can get by fairly wel using her note sheets. She's a stickler about attendance, but a fair and predictable grader and an incredibly kind and intelligent professor"
3050,1582688,5.0,3.0,I never rate professors but Prof. Smith is hands down the best teacher at the school. She can answer any question. Is so fair with grades and her study guides help you through the class. I don't really like Philosophy but I take her classes just because I know they will be interesting and she is so ready to help students.
3051,1582688,5.0,3.0,I love Professor Smith!  She is so nice and gives out the lecture notes from the day every day before class. So helpful when you talk to her outside class and definitely one of the most fair graders at W&L. Highly knowledgable and intelligent. I'd recommend any of her ethics classes!
3052,1582688,5.0,2.0,This is the only review I have ever written. Angela Smith is the best teacher at W&L. Why&#63; She is a fair grader. You are capable of getting an A if you earn it. She is smart enough to answer any question. She always comes prepared. She is always enthusiastic about class. She respects a range of views and does not simply push one on you.
3053,1582688,5.0,3.0,Conveyed the material and class expectations very clearly. I found the work load (in a non-spring term class) to be about average.  The class had a nice balance of lecture and discussion. Very nice as well
3054,1582688,3.0,2.0,Discussion based. Movie ever week. Too much reading for spring term class. Interesting material just at the wrong time for me!
3055,220770,5.0,3.0,"I LOVE Dr. Casey. I know some people feel really negative about him because of his political views, but don't let that put you off. He's really passionate and makes the material really accessible. He can seem snarky at times, but he's just very sarcastic and blunt. I'd highly recommend taking a class with him if possible!"
3056,220770,5.0,3.0,"Dr. Casey was fantastic in this course. The class was test-heavy with 3 exams plus a final. But, all seminar discussions covered the content necessary to do well on the evaluations. The content of the class was fascinating through its examination of technology and the effect it has on our world. Enlightening insight from a fantastic professor."
3057,220770,2.0,4.0,"We were graded on 3 tests plus the final exam. The final exam was not cumulative and was just based off the information that was crammed into the final two weeks of the course. While he is passionate about teaching, he his a horrible grader. Marks a 20 pt. question 100% wrong for a slight error. Also inflicts his political opinions on the class."
3058,220770,1.0,4.0,"Do not take for intro econ. Alongside his radical views (such as suggesting on Twitter that white people shouldn't be allowed to vote), class discussions have less to do with econ and more to do with spouting his political opinions. Fell so far behind that he made us come in for extra evening classes to learn 6 weeks of macro in the last 2 weeks."
3059,220770,4.0,3.0,"Professor Casey is the man. Great class for an intro econ course. Almost no homework. Relates everything to current/real world events. NO TESTS. Few quizzes which were super easy. Makes lectures super interesting. Drawback is that final exam is majority of final grade. Highly recommended professor, would take again."
3060,220770,4.5,1.0,"Great lectures and really gets students interested in the topics. The grading system is a bit unclear, but you will generally end up with a higher grade than you thought. Super helpful if you have any out of class questions and overall just a really chill guy."
3061,220770,3.5,2.0,"Professor Casey is one of my favorite professors. He is very straight-forward and knowledgeable. He graduated from W&L, so relates well to students. He does not care much about grades so as long as you give good effort you will get a decent grade in the class. Highly recommend taking a class with Casey."
3062,220770,4.5,3.0,"Casey is an amazing professor. He's so passionate about development economics, and definitely shares his compassion with the class. He's always willing to help if you need it. And he's one of those professors that really doesn't care so much about grades as long as you make an effort in the class."
3063,220770,3.0,1.0,He taught my Environmental Studies 110 class. It was his only non econ class and he was great. He is very straight-forward and easy to understand. He's very young and was a graduate of W&L so he knows how we actually are.
3064,220770,4.5,4.0,"Extremely interesting professor.  Very interested in the environment and human capital in third world countries and demands participation in class on these topics.  There is a lot of required reading for the classes, however, but most of it is intriguing."
3065,220770,3.0,4.0,never knew which guy would walk into class. one day would be really nice and helpful.  then he'd be the meanest man alive.  not a fan.
3066,220770,5.0,3.0,"Casey and Goldsmith are the only two econ. professors worth taking. He's a really good professor, makes it easy to understand some hard concepts and helps you get the most out of a research paper which if you haven't done a lot of stats seems kinda scary. Overall excellent Prof."
3067,220770,2.0,4.0,No Comments
3068,220770,5.0,3.0,No Comments
3069,220770,5.0,3.0,Might be the best professor in the Econ dept. (w/ Goldsmith as the other really good one). Makes a dry subject really interesting and relevant.
3070,421479,4.0,4.0,"If you're pretty good at Spanish and take good notes, you'll be fine. She wants very specific things in papers, and if you don't include what she wants, tough to get an A. Memorize notes for the tests. Lot of reading but definitely doable. I didn't mind the class - she makes you work hard for it, but if you participate, A's aren't impossible."
3071,421479,1.0,5.0,"Legitimately never worked harder to barely get better than a C. Unnecessarily harsh grading and not near enough assignments, so if you bomb one, you bomb the class. I spend 20+ hours on the final paper and got a B- following her instructions carefully. Save yourself, DON'T TAKE PROF CAMPBELL"
3072,421479,4.5,3.0,"I think Prof Campbell is great!  I have had two classes with her and thought both classes were good.  She was always super nice and baked us goodies on the last day of class!  She expects quality papers, but if you participate in class and do the readings, you should be fine."
3073,421479,5.0,3.0,"Campbell was my favorite professor I had last semester. She was really excited about the material, wanted her students to learn and have fun, and encouraged participation. Her grading was fair and she came into class with a great attitude AND candy every day. She does like majors a lot, but she is an AWESOME professor and I recommend her!"
3074,421479,3.5,4.0,"Really nice lady but not the best prof. Her subjects (spanish literature and theater) are boring enough as it is. tough class, very heavy reading and writing. Only recommended for surefire spanish majors. Not a good choice for taking care of a literature requirement."
3075,421479,5.0,4.0,"Great professor. She is incredibly knowledgeable and very organized. She lays out in detail exactly what she wants from you on the syllabus and on guidelines for each assignment. If you do the work and show an interest in the class, you will be fine. If you are lazy or disrespectful, don't expect much from her or from any other W&L professor."
3076,421479,3.0,4.0,"Professor Campbell has a bad rap with a lot of students, but it's not all deserved. She's very nice and knows her stuff, but she can be moody. She is also very feminist, so if you are writing about a gender subject tread carefully."
3077,421479,5.0,3.0,"Professor Campbell comes off as strict and serious in class, but you will get a VERY different impression from visiting office hours. She is VERY helpful, especially when it comes to papers. Class is monotonous (same every day), but will certainly prepare you for tests. Do the readings, visit hours, and you'll be fine."
3078,421479,2.5,3.0,"I did study abroad with her. To be fair, Campbell can be very nice. BUT she changes moods so quickly, acting nice one minute and like she hates you the next. She has no patience with students and has no business leading trips abroad with her bad attitude. She will make you feel stupid and will blame you for stuff that's not your fault. Avoid her."
3079,421479,1.0,5.0,"Most infuriating prof. I've had. Grading is extremely harsh yet arbitrary. Very judgmental, plays favorites. Loves embarrassing students in class, especially males. Instructions are unclear on assignments. Tests extremely hard. Honestly, there are no redeeming factors to her or her class. She has no business teaching here, avoid at all costs."
3080,421479,1.0,5.0,"I regret not dropping her class when I had the chance. Incredibly hard, and acts as if students have no other obligations other than her class. Our final day of class consisted of MEMORIZED 30 minute group representations of medieval Spanish theater. Plays favorites, and is incredibly hard to please once you're on her bad side. Very 2faced; awful!"
3081,421479,4.0,4.0,"VERY intelligent, but gets off to embarrassing struggling students. Likes to expose the lack of knowledge in easy targets. Some may argue that this teaching style is very successful. It worked for me. However, at the same time, she ruins her relationship with students by treating them so harshly. She will only ever have her cat."
3082,421479,2.0,5.0,"Professor Campbell is infact the devil. I don't see how someone who claims to be spiritual, as she does, could be such an evil woman. Her tests are infinitely more dificult than Ruiz's. When she does lose your work, which she will, she will accuse you of not handing it in or misplacing it. Drop her after the 1st class and do yourself a favor."
